sentence,aspect,label
YOU HAVE TO WORK FROM HOME ALL MONTH? OH WELL! RD ,work from home,other
The Corona-Virus ,coronavirus,other
The virus after spending one day in New York #Coronavirusnyc 8. Bmauro t ,new york,other
Me explaining to my grandchildren how a guy eating bat soup in China led to a toilet paper shortage in the US ,grandchildren,other
sen vespo Sous sor maydha the Corona Virus . We're meant to die from dimate change tomake kse Suf for asies ,climate change,other
UK taly Spain France China Coronavirus ,china,other
After quarantine you will either look like: You want eat up a Ponos You want to OR beat up Thanos othegoanyao ,thanos,other
"Trump said if you're having trouble finding protective face masks, try this instead. WHAT HAVE YOU GOT TO LOSE? ",donald trump,other
Time traveler: What year is it? Me: 2020 Time traveler: ,2020,villain
"TRUMP WOREA MASK! MEANWHILE, HIS BUDDY PUTIN PAID TALIBAN FIGHTERS TO KILL AMERICANS TRUMP DIDNT EVEN WEAR THE MASK BIGHT ",americans,victim
Deadly Wuhan Virus Speculated to Originate from Bat Soup ,bat soup,other
BECAME UNEMPLOYED BEFORE COVID-19 ,covid19,other
beshram memer Obeshram_memer After successfully human trial of #coronavaccine by russia Putin and scientists research team be like #RussianVaccine ,research,other
"we you ok with this NandosuK Me: Should i buy it? Ext HOt HOt Brain: No COVID Partner: No Alert Levels Bank account: No Medium Me: Sold PERI- omete, ",partner,other
SEPERATED AT BIRTH ,donald trump,other
Me holding in my coughs in public so People with the flu: stay home sick all day People with Coronavirus: ppl don't try and quarantine me travei an the Seven Seas ,flu infected people,other
When it's only been 48 hours and you've eaten your entire coronavirus stockpile ,villain,other
OFFICIAL DAYO @iam dha. Oct 23 Thursday Lagos covid-19 palliative plaw warehouse was discovered. Friday! Osun covid-19 palliative warehouse was discovered.Abeg which state be next? 19 ,lagos,other
"They should first test the covid vaccine on gov't officials. If they are safe, the vaccine is good. But if they die, the country is safe. ",vaccine,other
YOU HAVE TO WORK FROM HOME ALL MONTH? OH WELL! RD ,dog,other
Its for Your own good. You have to stor tou ching youur face ,face,other
"COVID19 Me All the work ve put into belng an adult, ny career, and having a real life on my own. ",covid19,villain
When COVID-19 is over and you can finally go finish the 8th grade. ,covid19,other
"Vikram Paralkar @VikramParalkar It's only Quarantine if it's in the Quarante province of France. Otherwise it's just Sparkling Isolation. 12:12 PM - Mar 13, 2020 - Twitter for iPhone ",quarante,other
IF IT CAME FROM WUHAN IN CHINA THEN HOW IS IT RACIST TO. CALL ITTHE CHINA WUHAN CORONA VIRUS? ,coronavirus,other
I'M NO GOVERNOR BUT 11 @cavemanhumor I WAS SHUTTING DOWN BARS LONG BEFORE CORONA VIRUS ,governor,other
r/dadjokes Posted by u/NAtionalniHlist - 3h What do you call an instagram celeb who got Corona? An influenzer. 904 + 19 Share ,instagram celeb,other
Government: work from home Farmers: ,farmers,other
Large amounts of Protests in the US US Cove 100k+ US COVID deaths 100k+ US COVID deathe Coronavirus Memes For Anyone Who Forgot That There's A Pandemic Going On ,usa,other
"""An act of modern piracy': A mask shipment from 3M bound for Germany was reportedly diverted to the US THE WHITE HOUSE Aye aye captain trump ",usa,other
SCHOOL LAST WEEK SCHOOL NEXT WEEK ,school,other
AND JUST LIKE THAT TRAVEL BLOGGERS COULDNT SELL MORE CREDIT CARDS ,travel bloggers,victim
"Citizens: You can't just let us die! The Government: ""This is America"" boredpanda.com ",american government,villain
"When China says calling COVID-19""Chinese Virus is racist Japanese Encephalitis Virus, Spanish Flu, Ebola and Zika virus Amlajoke toyou? ",zika virus,other
France says ibuprofen may aggravate coronavirus. Experts say more evidence Is needed MILITARY DOCTORS ,ibuprofen,villain
"*still in lockdown* People: I guess one more month and its over There's three, actually T6 ",people,other
ISTAYED AT WORK FOR YOU. YOU STAY AT HOME FOR US! ,stay at home,other
Breaking News: Trump agrees to heed CDC advice and wear a mask. ,centre for disease control (cdc),other
"Donald Trump Jr. O June 30 at 5:35 PM : •.. Solid point. This is what virologist wear to protect themselves from a virus. Don't worry, though. Your bandana probably works, too. ",bandana,other
hengyytoy.en.alibaba.com The Frog Pepe Latex Comic Meme Frog Trump Mask Prom Masks Prom Masks . ,mask,other
You failed to hoard enough TP! You have died of coronavirus. ,toilet paper,other
"I BET IF YOU TELL TRUMP THAT IF HIS SUPPORTERS DONT WEAR MASKS THEY WILL BE TOO SICK OR DEAD AND UNABLE TO VOTE FOR HIM, HE WOULD PASS A MASK LAW ",trump supporters,other
When you wanna go out But Parents put lockdown because COVID19 *dad *me ,lockdown,other
CORONAVIRUS OUTBREAK (COVID-19) NORMAL PEOPLE DIE-HARDHON PLAYERS: Behemoth's Heart Shrunken Head Barrier Idol ,covid19,other
Be like Darth Vader - Wears a mask - Doesn't visit his son and daughter -Socially and emotionally distant - Follows orders ,social distancing,other
HOW TO PROPERLY GREET SOMEONE DURING THE CORONAVIRUS OUTBREAK Imafilip.com ,coronavirus,other
FIRST PHOTO OF THE RUSSIAN VACGINE SMIRNOFE VODKA 3m ,smirnoff,other
Working from Home ,work from home,other
VIRUS RESEARCH BREAKTHROUGH MASKS PROTECT AGAINST MORON-73 ,donald trump,other
This Trump mask looks like Hitler from the back ,adolf hitler,other
Donald Trump ol moon from The Legend of Zelda: Majora's Mask lookin' ass. ,the legend of zelda,other
"Donald J. Tru. Tonight, GFLOTUS and i tested positive for COVID-19. We will begin our quarantine and recovery process immediately. We wil get through Dct 2, 2020 this TOGETHER TRUMP'S GOTTA GO00000 Gisitrealysin BUT.ITS A HOAX AND WILL MAGICALLY DISAPPEAR! CAN YOU SAY.CLOROX? 621 AM Oct 2, 2020 O 1.3K O 81 people are Tweelin ",jill biden,other
SWITCHED HER MASK.. TRUMP 2020- EP AMERICA GREAT SHE'LL NEVER KNOW! inglip.com ,2020,other
My coworkers and me ready for another day of Zoom meetings ,zoom meeting,other
10 Coronavirus Memes Work at Home STAY HOME SAFE ,coronavirus memes,other
HOMESCHOOL PROJECT MATCH THE LIDS ,project,other
rCONTROVERSYEy ,mask,other
"Citizens: You can't just let us die! The Government: ""This is America"" boredpanda.com ",usa government,other
"Just in case you are wondering how much the media controls people, America has been vaccinating cattle for coronavirus for years, yet the news tells you it's new and gunna kill you all so go buy mask.. 10 doses 20 ml Bovine Rotavirus- Coronavirus Vaccine Klled Virus Escherichia Coli Bacterin For veterinary use only ",coronavirus,other
everyone in their online classes now ,online classes,other
"ww3 memes Corona virus memes Made in china,so won't last long anyways. ",world war 3,other
HOMESCHOOL PROJECT MATCH THE LIDS ,homeschool,other
Corona Virus China Virus MEME WARS imgflip.com ,xi jinping,other
peradise is in my hands eseventeTumaler Trump :I have COVID Twitter: ,donald trump,victim
THE BIGGEST THREAT FACING AMERICA IS NOT THE CORONAVIRUS - ITS XENOPHOBIA. DON'T CALL IT THE WUHAN VIRUS OR YOU WILL BE BRANDEDA RACIST ,america,victim
Apocolypse we expected: What we got: ,apocalypse,other
Chai pe Charcha wih NaMo Cough Syrup with Kejriwal ,narendra modi,other
malaikaaroraoflicial- fellow Airport fashion 2019 vs Airport fashion 2020 ,2020,other
kwai gkwa 0964 #nnevvy applause to Thais from Hong Kong WHY THAIS DID NOT GET HURT? CULTURAL DIFFERENCE JUST STAY IN THE WALL ,hong kong,other
TRUMP FINALLY PUT ON A MASK BECAUSE HIS MASTER MADE HIM ,americans,other
TEAM MEETING CONFERENCE ROOM WORKING FROM HOME ,working from home,other
FACE MASK COMPANIES DURING THE COVID-19 OUTBREAK ,face mask companies,other
"HECHEVS THE WHITE HC WASHINGTON NIK NEWS SPECIAL REPORT LIVE WHITE HOUSE BRIEFING FROM CORONAVIRUS TASK FORCE FOR LATEST UPDATES, GO TO NBCNEWS.COM/CORONAVIRUS ",donald trump,other
ME AND MY FRIENDS PLANNING FOR HOLIDAY TRIP CORONA VIRUS @anushkafcs @anushkasharma ,coronavirus,villain
When you hear the Coronavirus is coming to America but you know Corona is a Mexican beer WALL boredpanda cem ,coronavirus,other
I WAS GOING TO MAKE A JOKE ABOUT THE CHINESE WUHAN VIRUS BUT YOU PROBABLY WILL NOT GET IT. imgflip.com ,wuhan coronavirus,other
"WHEN YOU FIND OUT YOUR NORMAL DAILY LIFESTYLE IS CALLED 'QUARANTINE' ""MIGHTY ",quarantine,other
WILSON THE ORIGINATOR OF SOCIAL DISTANCING ,wilson,other
You stole my COVID-19 face mask! You weren't using it! Zahra te.com ,donald trump,other
Donald Trump wears a face mask in public for the first time A he dumb vuS deriers ,donald trump,other
GT Global Times A person from Yunnan Province died while on his way back to Shandong Province for work on a chartered bus on Monday. He was tested positive for #hantavirus. Other 32 people on bus were tested. 家河铺 ,hantavirus,other
ME THINKING ASCHOOL IS CANCELLED BECAUSE OF CORONAVIRUS ONNLINE SCHOOL ,school,other
DID YOU HEAR OF MAKING CORONAVIRUS MEMESP THE MOVEMENT'S YES-WHAT ABOUT THEN? CONTAGIOUS. ,coronavirus memes,other
INDIAN BOYS DURING LOCKDOWN WHEN GIRLFRIENDS ASKS TO COME HOME: ,girls,other
Class of 2021 making memes on Class of 2020 having an online graduation Class of 2021 realizing they might have an entire year online made with mematie ,class of 2020,other
"Skype Bil Gates Co Chair, Bl & Melinda Gates Foundation LIVE do Thour ago I believe him. This man's been dealing with viruse since Windows 95 wes ",virus,other
government: work from home railroad workers: ,government,other
XPERT ON COVID THIS IS THE CURE ,covid19,other
KID: HEY MUM WHEN IS THIS CORONA VIRUS THING GONNA BE OVER? MUM: JUST SHUT UP AND EAT YOUR TOILET PAPER ,toilet paper,other
"TRUMP TRIED TO GET AWAY WITH ONLY WEARING HIS MASK WHEN THE PRESS WASNT AROUND. SOMEONE FROM TMZ WAS AROUND, THOUGH. ",press,other
indian cook getting boycotted for selling indian chinese gobi manchurian ,indian chinese,other
When it's finally 2020 but you realize New Virus Related to SARS May Be Behind Mysterious Pneumonia Outbreak in China that both 1820 and 1920 had massive plague outbreaks ay Achael etner - Senior Witer 10 hoursag -Hmm -Fuck ler Oh my God it's happening! Everybody stay calm! Everybody stay calm! China has begun killing the Karens ,virus,other
Work at Home Mom Wat Secieny Thints ilo What y Mem sin What TI Whail What yestand Wtes ID Whalilada e 18 Working From Home Memes That Perfectly Sum It Up| Sayinglmages.com ,mom,hero
KILLED BY ALCOHOLE TEMPERATURES ABOVE S7OEGRESI WORLDOCOM Experts Say Deadly Wuhan Virus Can Be Killed By Alcohol & High Temperatures! Corona Corona ,scientists,other
When Disneyland has to enforce the newest COVID-19 restrictions ,covid19,other
COVID IS KILLING AMERICANS AT THE RATE OF ONE 9/11 EVERY THREE DAYS. WEAR THE DAMN MASK. ,covid19,villain
Time traveler: What year is it? Me: 2020 Time traveler: ,time traveller,other
RELEASE THE VACCINE WHAT ABOUT PHASE3 TRIALS? I SAID RELEASE IT ,vaccine phase 3 trial,other
corenavirun coroninvira honestiy i did R for memes 102SPM 26 Jan 20 Twme for Andraid 100M Retiveers 200 Le ,coronavirus,other
When you still want to travel while in Coronavirus season ,travel,other
THAT SUDDEN SHOCKING MOMENT MOKKAENGINEER LOTUS FIVESTAR DVD D ON SEEING OUR FRIEND CHATTING IM ENGLISH IN WHATSAPP BOYS-GIRLS GROUP ,whatsapp,other
"BREAKING Trump not allowed into Scotland to escape Biden inauguration, Scotland's First Minister says. ""Coming to play golf is not what I would consider to be an essential purpose,"" Sturgeon said, alluding to COVID travel restrictions. Reports indicated Trump may have planned an imminent Scotland trip. Ruin Donnie's day! Spread the word! CALL TO ACTIVISM- ",scotland,other
JUST TOOK THE COVID 19 VACCINE I WANT MY MONEY BACK abc ,covid19 vaccine,villain
Parents of little kids trying to work from home while schools are closed: Dwith lowe beocu THERE IS NO QUIET ANYMORE. THERE IS ONLY DOC MCSTUFFINS. ,schools,other
MASKS MATTER. THEY SAVE LIVES. ,mask,other
joking about a new plague happening new disease starts in china ,disease,other
"coronavirus @coronavirus honestly, i did it for memes 10:25PM 26 Jan 20 Twitter for Android 100M Retweets 200 Likes > ",coronavirus memes,other
Gazzillion Ear Lyrics Wear a mask like yo off the Gong Show MF DOOM ,mask,other
When the people of Wuhan are wondering why there's only 1 plane coming to disinfect the city China Exterminates the Coronavirus in Wuhan (2020) ,coronavirus,other
Every time somebody coughs around me ,covid19,other
We also tell them to stay at home CORONA IS REAL G-jOw ,corona,other
UFC was here Khabib vs. Tony COVID-19 ,ultimate fighting championship (ufc),other
"MY DOCTOR AFTER THE RUSSIAN COVID VACCINE. PATRICKISASAVAGE IF HE DIES, HE DIES. imgflip.com ",russian covid19 vaccine,other
Trump: say make America Great Again! Baby: whatever helps you mask your racist agenda carrot face Trump: what Baby: goo goo ga ga? HONE RUMP ENTIAL AKER This baby woke af Fake Baby Memes ,mask,other
People with the flu: stay home sick all day People with coronavirus: I travel the world and the Seven Seas ,people with coronavirus,villain
Jehovah's Witnesses knowing that everyone's gonna be home: Eoredpanda.com ,anthony adams,other
IF IT CAME FROM WUHAN IN CHINA THEN HOW IS IT RACIST TO. CALL ITTHE CHINA WUHAN CORONA VIRUS? ,wuhan,other
blakelively 15h What should i weer to the supermaat? gloves en ,gloves,other
"GAME OF THRONES ""CORONA EDITION ",toilet paper,other
Flexing in March 2019 Flexing in March 2020 Purel ,2019,other
We Are Family Dad Mom Son THEFUNNYBEAVER.COM ,family,other
COVID-19 DOESN'T AFFECT THE YOUNGS YOU'RE NOT YOUNG ANYMORE boredpanda.com ,covid 19,other
"I washed my hands so much due to #CODVID19, that my exam notes from 1995 resurfaced ",hand wash,other
WHAT IF THE REAL REASON PRESIDENT TRUMP DOESN'T WEARA FACE MASK IS BECAUSE HE KNOWS THAT COVID-19 WAS A BOTCHED 2019 FLU SHOT THAT IS KILLING THOUSANDS WORLDWIDE AND PRESIDENT TRUMP IS A AN ANTIVAXXER. ,covid19,other
"China officials knew of coronavirus in December, ordered cover-up, report says WORLD OWES CHINA ""GRATITUDE AND RESPECT FOR CORONAVIRUS RESPONSE ",tedros adhanom ghebreyesus,villain
"cuture New Study Confirms Cats Can't Spread COVID-19, But Would If Given Option ",cats,other
"Donald J. Tru. Tonight, GFLOTUS and i tested positive for COVID-19. We will begin our quarantine and recovery process immediately. We wil get through Dct 2, 2020 this TOGETHER TRUMP'S GOTTA GO00000 Gisitrealysin BUT.ITS A HOAX AND WILL MAGICALLY DISAPPEAR! CAN YOU SAY.CLOROX? 621 AM Oct 2, 2020 O 1.3K O 81 people are Tweelin ",covid19,other
"Normal sick people: ""stay home* People with Coronavirus: Diseases! I brought diseases 111 ",stay home,other
People Who Invented Vaccine MPOKYPATVP ABTOHOMHOT ECTIVERINE Puin Who Only Announced Vaceine ,vaccine,other
NEWS Experts Say Deadly Wuhan Virus Can Be Killed By Alcohol & High Temperatures! Pubisheel 5 days ago on daary 2. 2020 By Chee Kin Corona Coronal ,corona beer,hero
GPAN Gricatapie Weed Kills Corona Virus. Scientists are shocked to discover that Weed Kills Corona Virus. 4coronaviruse coronarivirus LIVE BREAKING NEWS WEED KILLS CORONA VIRUS SCIENTIST ARE SHOCKED TO DISCOVER THAT WEED KILLS CORONA VIRUS 458 AM Feb 4.2020 Titie orAvaoe ,coronavirus,other
HIN1 Virus COVID 19 - U.S. CASES - - US. CASES - 60.8 MILLION (dete an) - PANIC LEVEL - Norrniv 9 - PANIC LEVEL- ZERO MASS IHYSTERIA - CHINA BLAMED- TRUMP BLAMED - Whieh of thene prenident perea37 MIL paur e Wahan labut ,china,other
When my mom asks me why I don't want to go to the Chinese restaurant owned by the guy who just came back from a trip to Wúhan ,restaurant,other
"Protect Yourself From Viruses! 20 Day Shipping from Wuhan, China Every Mask Has Been Human-Tested in Our Wuhan Factory For Quality Assurance 50% OFF XDoubt ",wuhan coronavirus,other
WHEN COVID-19 CAUSES A TP SHORTAGE BUT YOU KNOW HOW TO CROCHET ,covid19,other
"ILEO ANE COVID-19 IS A LIE NFD A Trump supporter in California holds a sign saying ""COVID-19 IS A LIE"" while a mask and hazmat suit ",mask,other
When your administrator starts blowing up your inbox with hundreds of new things you now have to do because of COVID-19. BORED TEACHERS I ONCE THOUGHT I HAD AFRIEND. ,administrator,villain
coronavirus - how to wash your hands tum on the water wih your muth o your diny hands dont such the tap pemly wipe each finger with a tiny wet cloth for I saoond (3 use your toeth to remove any din from under your fingemaik that you might hove missed dry your ckan hunds on a childs hair ,coronavirus,other
PUTTING OUT A REALLY SCARY PUMPKIN NURSING SCHOOL FOR HALLOWEEN ,pumpkin,other
Donald trump doesn't have the credentials to be pr- DONALD J TRUMP INDUCTED INTO THE GAMING HALL OF FAME A Dude Payday 2 finally has th Trump mask. Fuckin lit -Seth ,donald trump,other
Covid-19 Effect *Crude Oil Prices* Then Now ,crude oil,victim
Internet Explorer @internetexp. Breaking News: 2 reported cases of a new virus in China 03:11 PM - 18 Mar 20 42 Likes ,internet explorer,other
"WORK FROM HOME' MEMES Your manager when the work which takes 15 minutes has not been submitted from more than an hour because the employee is on work from home SO DAYA, KUCH TOH GARDBAD HAI REDIT: @GANDALFDGREY/ UNSPLASH (REPRESENTATIVE IMAGE) ",cid,other
WELCOME TO WORKING FROM HOME THE PLACE WHERE THE HOURS YOU ACTUALLY WORK ARE MADE UP AND YOUR PANTS DON'T MATTER ,working from home,other
When you open up the assignments folder on Google When my students ask me if Classroom and half of them are blank. things are going to go back to normal soon. I HAVE NO IDEA ,assignments,other
d TIKTOK Oeyes Johnson when I realize my shirt was made in China and China has the Coronavirus ,shirt,other
CAN'T KEEP VIRUSES OUT OF WINDOWS 10 WANTS HIS COMPANY TO DEVELOP THE VACCINE FOR THE WUHAN VIRUS ,wuhan virus,other
The. Guardian Eminem criticises non-mask wearers on new rap track 1 day ago AP Associated Press Trump wears mask in public for first time during pandemic 4 hours ago Coincidence I THINK NOT ,eminem,other
HOUSE WA Dr. Fauci unveils a mask that could save millions of lives! ,dr. anthony fauci,hero
RUSSIAN NURSE GETS SUSPENDED FOR WEARING JUST HER LINGERIE UNDER SEE-THROUGH PPE KIT *Harami Frn Going To Russia Porno Frn Going Me Going To Russia To Russia ,russian nurse,other
"RIE NREESS REPORTER: Is there any evidence to suggest that, as with malaria, it might be used as a prophylaxis against COVID-19? ",coronavirus,other
WHEN I SEE A CHINESE BOY COUGHING ME: KILLTHE VIRUS moflip.com ,chinese boy,other
I'VE OFFICIALLY REACHED THIS LEVEL OF QUARANTINE. When you catch your kids eating a family size bag of tortilla chips for breakfast but then realize you don't have to cook I'll allow it. ,quarantine,other
What a plot taist Aquaantinememer TILnever let my kids sit intro ME 2020 K RGARTEN IN 202 Sur ,2020,other
The Chinese Coronavirus Kung Flu ,kung flu,other
My Immune System Face Mask Me Alcohol Cor Corona Virus ,face mask,other
Texas LIVE 19:45 BREAKING NEWS Chuck Norris has been exposed to Coronavirus (COVID-19) The virus is now in quarantine for 14 days ,quarantine,other
Work from Home Expectations Reality ,working from home,other
HOW AMERICANS PROTECT THEMSELVES AGAINSTCORONAVIRUS ,americans,other
Even simean knows the importance of sanitining. Watayanfefromcoronavirun HeneMe ,sanitizer,other
He is unimpressed with his unnecessary COVID scan boredpada.ccm ,covid scan,other
China spent the crucial first days of the Wuhan coronavirus outbreak arresting people who posted about it online and threatening journalists Start tacking the problem Immedately OR draw 25 ,journallists,other
"Romain Revert Gromainewvert Due to less air pollution the sky is so clear !I can see the Universal logo ! 935 PM Apr 13, 2020 ",sky,other
"Unnecessary Lyrics ROYALTY Same gun and pants, different ski mask from coppers Childish Gambino / ScHoolboy Q/ Ab-Soul ",ski mask,other
"MAKE AMERICA GREAT AGAIN BY SPREADING COVID SERIOUSLY, YOU HAD ONE JOB. ",donald trump,villain
Anti-vaxxer logic Anti-vaxxer parents when they see a popular 18th century disease that's been nearly eradicated: Hmm. This bridge is only 99.99/% sate. O think Pl swim Oh fuck yeah spreod it ,anti-vaxxer's parents,other
IF YOU COULD STOP STEALING MY MEMES THAT WOULD BE GREAT ,memes,other
"Everyone at the store: ""They had butter today."" ""Blessed be the fruit."" ""Praise be."" 1046 ",butter,other
the entire state of KY governor andy beshear ,coronavirus,other
"TRUMP ""STOP TRYING TO MAKE FACE MASKS HAPPEN, CAUSE ITS NOT GOING TO HAPPEN ",donald trump,other
Mayureah rabrsiakabost - Th Detol gives you 00% The Spectator Index Bapectatonindex Coronavirus vaccne elficacy ate. Moderma M Pfizer: Over 90% Vaccine COVID-19 ,moderna,other
"Me to my boss: I'm going to work from home for the foreseeable future out of concerns for COVID-19, but l'll be just as productive at home! Me at home: Me: what a productive day Narrator. wasnT NETFLIX wn pat. gn at 701 Porn hub ""Sounds good, lets chat tomorow ",covid19,other
"CDC PUTS RAPPER IN CHARGE OF VIRUS SCREENING NAGA ""WUHAN, I GOT YOU ALL IN CHECK!"" nakeamengro ",virus,other
Magale Mo @MogaleMa07 Not even a single pastor is going to China to cure Corona virus? 312 PM 19 Feb 20 Twitter for Android ,china,victim
"Eily randwin eciupg The White House praising Trump's mask wearing is like a parent praising their potty training toddler. ""Donny wore a mask ""Now, can Donny make a boom boom in the potty?"" Brad Parscale e @parscale #AmericaFirst ",white house,villain
Shaan Rasul Keswani Vissal Storyteller March 20 at PM On great more bad news When you open another COVID-19 MASSMAIL from President Tim Killeen and Chancellor Jones AM READY TO GET HURT AGÅIN. ,covid19,other
"IEN When's Happy Hour? ho @whenshappyhourt When the first thing my coworker says during our zoom meeting is ""hey, how are you?"" mow""an ",zoom,other
When people is making memes instead of being scared 8. ,coronavirus,other
PAYS NO TAXES WEARS NO MASK HAS NO CONSCIENCE ,taxes,other
ALL OF A SUDDEN EVERYBODY HAS BECOME SHELDON ,sheldon,other
WHEN YOUR BOSS EMAILS YOU AND ASKS TO HOP ON A QUICK VIDEO CALL RD ,video call,other
AND JUST LIKE THAT THERE WERE NO MORE ANTI-VAXXERS ,anti-vaxxer,other
Zoom meeting VALI With video Audio only ,zoom,other
WHEN I SEE A CHINESE BOY COUGHING ME: KILLTHE VIRUS moflip.com ,virus,other
Government: Work from home Sports Commentators: ,government,other
"LET ME BE CLEAR. I IGNED THE MEDICAL APPLIANCE TAX BILL THAT FORCED COMPANIES TO OUTSOURCE MANUFACTORING OF MASKS, GOWNS, GLOVES AND VENTILAORS TO CHINA, EUROPE AND RUSSIA TO AVOID THE TAX. ",mask,other
Day 1 without Casinos ,hand sanitizer,other
"If coronavirus was a person ""All Student Organisations, Societies, Teams, Groups, and Clubs are henceforth disbanded. All Quidditch matches are hereby cancelled. Boys and girls are not permitted to be within 8 inches of each other ",girls,other
*Corona virus is a dangerous virus that can kill Easley Chinese:*eats it anyway the virus: The Chinese virus can eat everything ,chinese,villain
DON'T LIKE TO WEARA MASK GOVA Red Kidney Bea Frijoles Colorado GOVA PREMUEM TRUMP HAS THE SOLUTION ,mask,other
"Man Who Works From Home Keeps Naming His Dog 'Employee Of The Month' By Jula Barim Jaruary 2, 2019 - 3 min road curide Accuride En r MEEKA MEEKA MEEKA ",works from home,other
Other countries: Have normal health and food regulations that keep the public safe from infectious and potentially deadly diseases China: BAT SOUP ,other countries,other
COVID19: 28 DAYS LATER WHERE THE HELL IS EVERYONE? ,covid19,other
AND JUST LIKE THAT TRAVEL BLOGGERS COULDNT SELL MORE CREDIT CARDS ,school,other
TRUMP FINALLY PUT ON A MASK BECAUSE HIS MASTER MADE HIM ,vladimir putin,villain
"GUESS I SHOULD HV WORN A MASK WHO FARTED, WAS IT YOU? ",donald trump,other
Government: work at Home Government: Work from home Therapists: Architect: ,work from home,other
beshram memer Obeshram_memer After successfully human trial of #coronavaccine by russia Putin and scientists research team be like #RussianVaccine ,scientists,other
"*A new lethal virus starts spreading* Africa, nol What? Sorry. Force of habit. China, no! ",world health organisation,other
When You Can't Go To Different Countries Anymore. ,narendra modi,other
WHO: Quarantines millions of people in their homes to stop the spread of COVID-19. Pomhub Execs: ,who,other
"America Also America I think I forgot something. If you forgot, then it wasnitimportant. ",america,other
"AFTER LISTENING TO, LINDA, HIS HUMAN, FOR 12 DAYS WHILE IN QUARANTINE AS SHE COMPLAINED FOR HOURS ON END SPARKY REALIZED HE WAS NOT CUT OUT TO BE AN EMOTIONAL SUPPORT DOG imgfip.com ",sparky,other
MASK IDEAS ,mask,other
Kat atoeswenth Ncoronavirusmemes Currency in the new world: Disinfectast Spray RIRNOF Purel 4 AM Mat 14 200 twitter ar itone ,sanitizer,other
"""WORK FROM HOME memegenerator.net. ",work from home,other
KINE everyone You think this is funny? people drinking bat soup and eating live rats in China Posted in r/CoronavirusMemes by u/jad020 Inddr ,people eating live rats in china,villain
TROUBLESOME KIDS CRDIT Twite/alisheeni n ,kids,other
Got this big roll of toilet paper as a gag gift for Christmas. Whose laughing now!? ,christmas,other
Seal of approval Are you tired of all the covid-19 memes? Look at this cute seal! ,covid memes,other
MAKE AMERICA HATE AGAIN TRUMPSTERS CAN FINALLY WEAR THEIR MASKS IN PUBLIC! imgflip.com ,maga hats,other
Other countries: Have normal health and food regulations that keep the public safe from infectious and potentially deadly diseases China: BAT SOUP ,china,villain
EVERYONE END COVID 19 inglip.com ,covid19,villain
