sentence,aspect,label
Everyone makes memes about ww3 Covid-19 appears Everyone: maa with mino was not expecting that. Covid-19 meme ,world war 3 (ww3),other
"When this is over and my boss tries to tell me I have to be back in the office, on time, all 5 days of the week #MemeThisQuarantine This work from home thing is not working. You're serious? Oh my god l-need help. GIF @brewpound ",boss,other
This Trump mask looks like Hitler from the back ,hitler,other
DIVORCE LAWYERS WAITING FOR PEOPLE TO BE QUARANTINED WITH THEIR SPOUSE FOR WEEKS ,spouse,victim
me when the vaccine drops on the NHS ,nhs,other
Government: work from home Construction workers: wrestlers working from home their family ,contruction workers,other
"Government: ""work from home"" Zoo keepers: ",zookeepers,other
PAYS NO TAXES WEARS NO MASK HAS NO CONSCIENCE ,donald trump,villain
chinese new year 2020 be like CNY memes Wuhan virus memes CNY memes Wuhan virus memes SGAG ,memes,other
"Corona Virus Pandemic, Daylight Savings Time, Friday the 13th and a full moon all in the same week... Who the hell is playing Jumanji? ",coronavirus,other
C. BLONO ONE IN ANTARCTICA HAS CcOVID-19 DAD DON'T ITS BECAUSE THEY'RE ICE-0-LATED BLOCK DAD STOP PLEASE ,covid19,other
CORONAVIRUS QUARANTINE - DAY 23 SKIN HAS FUSED TO COUCH ,donald trump,other
Covid-19: exists English teachers: We must over analyze this Please write a 6 page essay on the covid pandemic ,essay,other
DoVoubonald.com COoyoudonaldc Can't die of COVID if you kill yourself! #Trump #Memes Is this a vaccine? ,lizol,other
WUHAN VIRUS IN ORANGE COUNTY NICE PLACE. NIGGA. ,wuhan virus,other
"""We need to reopen America"" America right before it reopens: ",america,victim
Сгуptic @CrypticNoOne Class of 2020 gonna have their prom at the club penguin dance floor 10:55 AM - 12/03/20 - Twitter for Android 10.6K Retweets 52K Likes ,2020,other
COVID-19 is everywhere but countries with heads of state managing the crisis better seem to have something in common. GERMANY NEW ZEALAND BELGIUM FİNLAND ICELAND DENMARK ,denmark,other
how a guy eating bat soup in China led to a toilet paper shortage in the US ,usa,victim
When you think about the possibility of Halloween being affected by Covid 19... ,halloween,other
Otark.sinatra 2nd wave of coronavirus States reopening too soon ,coronavirus,other
Coronavirus won't stop Betty going to the bingo. ,betty,other
"Government officials: It's really hard for kids to get COVID-19, so everyone in schools will be fine. Teachers and staff: Ostudentsaynhat ",schools,other
"SCHOOL: GIVES US HOURS OF ONLINE SCHOOL BECAUSE OF CORONA ME: THAT'S TOO MUCH SCREEN TIME THAT THE CORDNNARUS SGOING T0 KILL US ALLI on WORSE. CAN'T BE GOOD FOR MY EYES THE SCHOOL: MESS WITH THE DOONOY. You dare use my own spells against me, Potter? SHE NEEDS TO SOORT OUT HER PRIORITES ",coronavirus,other
IF MY GRANDMA WAS STILL ALIVE I WOULDNT HAVE TO WORRY ABOUT COVID19 VICKS VapoRub Werining Ointent MEVES DISTRESS OF COLOS BECAUSE NO ONE WOULD COME WITHIN 5 FEET DUE TO SMELL OF VICK'S AFTER SHE COVERED ME IN IT ,covid19,other
Mow SMOMLO We DEAL WITN HE WONAN VIAUS SREADING EVERYWMENE BE TRANSPARENT ALERT THE ABOUT IT WORLD COVER IT UP aUTAND COMALAINS CALL TM A RAC ,xi jinping,villain
This is the first time in english literature question and answer both are same Q: Who declared Corona as a pandemic? A: WHO declared Corona as a pandemic . GE ,world health organization (who),other
"""THEY SAY YOU SHOULD WEAR A MASK. I DON'T NEED A MASK. I'M HEALTHY."" GREAT - THE COVIDIOTS HEARD YOU imgflip.com ",masks,other
*When someone enters the room without wearing a mask STAY AWAY FROM ME ,mask,other
"WHEN GOVERNMENT ANNOUNCE LOCKDOWN HAS EXTENDED, BUT FOR YOUR OWN GOOD. #LockdownExtension ",lockdown,other
"clean slate @PleaseBeGneiss [months from now] CDC: aight it's safe to go outside Me: ""now fluent in 6 languages, daily phone calls with grandma, black belt, 8 hours+ sleep each night, skin looks AMAZING, befriended a spunky spider under the fridge"" are..are you sure? ",centre of disease control (cdc),other
INDIA ITALY we have over 10k infected with coronavirus 10k? we have over 150k & counting USA CHINA 150k? we have over 570k & Vouguys are COunting? Counting ,coronavirus,other
Homeschool Day Homeschool - Day 2 ,home school,other
"China officials knew of coronavirus in December, ordered cover-up, report says WORLD OWES CHINA ""GRATITUDE AND RESPECT FOR CORONAVIRUS RESPONSE ",xi jinping,villain
"Okilled 3000 New Yorkers during 911 Hold my beer. Ikilled 30,000 New Yorkers AMERICAN CRISIS and wrote a book! LEADERSHIP LESSONS FROM THE COVID-19 PANDEMIC ANDREW CUOMO ON SALE OCTOBER 13, 2020 imgflip.com ",new yorkers,victim
Stores in china when all there customers die of a virus. not stonks 3510 26 1.550 0.12 Made this after some guy made a post begging people to stop making China virus memes! ,coronavirus,other
"YOU WOULDNT STEAL TOILET PAPER I work at woolies, let me show you how scared the coronavirus has people O BOX HILL, VICTORIA ",coronavirus,other
Hairdressers leaving the house after quarantine Everyone else leaving the house after quarantine ,quarantine,other
This is Called Work From Home WHAT MY CO-WORKERS SEE WHAT THE BIRDS ON MY ROOF SEE ,coworkers,other
"THE WI ""WEAR A MASK WHETHER YOU LIKE IT OR NOT IT'S ABOUT PATRIOTISM"" SILVIEW.media ",donald trump,villain
Corona-virus can be killed by alcohol Adults Kids GUESS I'LL DIE ,coronavirus,other
ME IN QUARANTINE CONTEMPLATING IF 10AM IS AN OK TIME TO DRINK ,quarantine,other
THE DOCTOR SAID IT'S COOTIES. OTHINK YOU SHOULD GET YOURSELF CHECKED ,doctor,other
This reboot looks scarier than the original tentem Pwin canrtor nia oCaou pick tpareas Dent bother COSTCO aby baywitwaja ana te NO ,costco,other
"""H COVID man relly carried on your breath, why aet hunaha na thena Wy de they • MISLEADING wryback of your a Wake up. ETE VRAS IS SPREADKADROEF SALA. TNELE ORP OF SALNA CAN INFECT AN ENTRECITE. EKR HEA TORLE THETSAMPLE ",covid19,other
"YO FE to DACK VIES- RATIOR 10 +22 One protester even stuck a Trump mask to the wall, giving him a toothbrush mustache, the same style worn by Adolf Hitler, and writing inside a speech bubble: 1 like scat sex' ",donald trump,villain
LAS VEGAS MAYOR WANTS TO REOPEN SAYS DEATH IS A PART OF LIFE ab13 IF THEY DIE THEY DIE ,carolyn goodman (las vagas mayor),villain
"instituted among Mon, deriving the verned That Form any e end the Righ People te a y such Koaly MASK RIGHT HERE Ma deriving the Sernment form,a lence, as I HAVE A over instituted among any Form e ends, it is the Rigie Pecple to al verned, That vrnment, lay such form as IDON'T WEAR Tover A MASK LĪKE HIM ence, G truth tlesilent. that al nen e crtdyual that they are endend by thi Gater with ertein unaoe Rhu, th Llrty and the pnit Gernnonte re inatituted emeng Mon. there are structive efthe end iti A e ar Instituto r layiny ita fundetion en pe in aurh firman te then ahllom lyt Happanan. hudenc infol wil EVERY TIME I SEE HIM HE'S GOT A MASK WORn trutha to kl/ evident. that all mon a creutid oyual that they are LI Liny and the punnit of Hoprinan - istituti Gen layiny ita feom ndetion HE SHOWS UP WITH THE BIGGEST MASKI HAVE EVER SEEN COVID-19 POSITIVE imgflip.com ",masks,other
"re Photos IF YOU LOVE AMERICA, YOU'RE GENERALLY A CONSERVATIVE. IF YOU HATE AMERICA YOU'RE USUALLY A LIBERAL Cprione ",conservative,hero
turns out my top 3 hobbies are: 1. eating at restaurants 2. going to nonessential businesses 3. touching my face ,hobbies,other
Novel Coronavirus has human to human transmission Introverts: CELEBRATE LIKE A BOSS Introverts will rule the worid ,introverts,hero
Working from home as a parent. ,parent,other
Government: work from home Lifeguards: ,lifeguards,victim
government: work from home chemistry teachers: ,government,other
"If you were selling nudes to help raise the funds needed to tackle the global Coronavirus crisis, I'd donate John ",coronavirus,other
THE BRITISH SING'GOD SAVE OUR QUEEN THE QUEEN: LIVES 93 YEARS THE BRITISH: was not expecting that. ,queen,other
noluv du Gtaleyinagat Best #coronavirus #meme yet Imao Texes LIVE BREAKING NEWS Chuck Nomris has been exposed to Coronavirus (COVID-19 |The virus is now in quarantine for 14 days r040 PM - Mar 14. 20to Ttter for Androd ,coronavirus,victim
KID: HEY MUM WHEN IS THIS CORONA VIRUS THING GONNA BE OVER? MUM: JUST SHUT UP AND EAT YOUR TOILET PAPER ER 新 ,toilet paper,other
FEAR OF RIOTS IS ON THE DECLINE SWITCH BACK TO CORONA SWITCH BACK TO CORONA! ,riots,other
JOE BIDEN IS CRITICIZING TRUMP FOR NOT WEARING A MASK. MAYBE IF BIDEN HAD BEEN SOCIAL DISTANCING FROM WOMEN AND LITTLE GIRLS INSTEAD OF SNIFFING AND KISSING THEM TARA READE WOULDNTBEBREATHING DOWN HIS NECK. ,social distancing,other
CHINA GAVE HUNTER $BILLIONS CHINA GAVE THE PLANET COVID-19 WORKS FOR ME ,hunter biden,other
"Berenber-veryone who looka Chinene ipect fom now on WHEN I SEE A CHINESE BOY COUGHINGey cgh anywhere n put, vy n. Ma the fe eheyreaspevtthe hen ef the Buok Deat They conont yeu abeut ae yere soed for your e ae wmed consider protectine yorat ther epereif you bomeane whom you beleve tot you hvea good chance to be acquitted npecialyityou donit talk ta the cops and petalay Esnaoleraon an imnedute drgery ME KILLTHE VIRUS HI,I'm trom china Me ",coronavirus,other
"DEAR NOVEL CORONAVIRUS, YOU WILL PAY DEARLY FOR THIS! ",coronavirus,villain
When you start coughing blood but the first symptom of coronavirus is DRY cough ,coronavirus,other
CHINA IS WHERE THE VIRUS ORIGINATED CHINA SILENCED WHISTLEBLOWERS AND COVERED IT UP CHINA LIED TO THE WORLD ABOUT THE EXTENT OF THE OUTBREAK CHINA REFUSED OFFERS OF HELP IN CONTAINING THE VIRUS CHINA INFECTED THE WORLD ,world,victim
government: work from home railroad workers: ,work from home,other
"emissthugger Trump tested positive for Covid-19 and I am pretty sure the Simpson's have never lieda#TrumpHasCovid 12:52 AM Det 2, 2020 Twitter for IPhone ",the simpsons,other
THE BIGGEST THREAT FACING AMERICA IS NOT THE CORONAVIRUS - ITS XENOPHOBIA. DON'T CALL IT THE WUHAN VIRUS OR YOU WILL BE BRANDEDA RACIST ,joe biden,other
willitv Tant I HAVE A MASK RIGHT HERE I DONT WEAR A MASK LIKE HIM EVERY TIME I SEE HIM HE'S GOT A MASK HE SHOWS UP WITH THE BIGGEST MASKI HAVE EVER SEEN COVID-19 POSITIVE ,joe biden,other
THIS IS DONALD TRUMP @_thebles UNDER HIS MASK makeameme.org ,mask,other
Australia: everyone needs to work from home and school will be run online The NBN: ,school,other
Ceant Gan Menes Social Distancing Day 2 The pame group is not happy alter I tell them that we are playing Twillight Imperium tomorrow ,social distancing day,other
"SAY PANDEMIC MASK OR COVID-19.ONE,MORE TIME I DARE YOU DOUBLE DARE YOU MOTHERFUCKER ",pandemic,other
Remember thinking that the mayor from JAWS was a complete idiot for keeping the beaches open? People complaining about the Covid-19 quarantine are like the mayor from JAWS bcredpanda.com ,people complaining for covid19 quarantine,villain
CORONA BEER CHANGES THEIR NAME TO AVOID ASSOCIATION WITH THE CORONA VIRUS OUTBREAK Eb Ebol Ehola Ebola Extre Extra ,coronavirus,other
"Coronavirus: *infects Tom Hanks* adam.the.creator • Following The Covid-19 Vaccine Competition Everyone: adam.the.creator o Oh hell naw, ok enough is enough fuck this virus 1w drgrayfang I gotta pee 1w 36 likes Reply View replies (2) daviddoesbigmeme Wait till it gets Danny DeVito 1w 391 likes Reply View replies (37) Fadam the creator eliastheodorou O Now We Riot!! Liked by drgrayfang and others MARCH 11 Add a comment.. Post ",coronavirus,other
"RIE NREESS REPORTER: Is there any evidence to suggest that, as with malaria, it might be used as a prophylaxis against COVID-19? ",malaria,other
Worldwide stock markets crashing The guy who ate a fucking bat ,guy who ate bat,other
Travel plans in 2020 be like : Expectations Reality ,2020,other
Working From Home What society thinks I do. What my family thinks I do. What my friends think I do. LOGO co YA What my clients think I do. What I think I do. What I really do. ,working from home,other
nobody: not a single soul: not a single covid-19 patient: EdUcAtlon SySteM: can get them degresse then have done my ob mede wth memate ,covid19,other
Teacher: Why are you late? Me: Traffic Teacher: But it's an online class Fuck ,queen,other
"""In the year 2020 humanity was threatened with extinction. Panic spread across the planet like never before"" ""What were you doing grandpa?"" ""Just sending memes to friends and stuff"" ",grandpa,other
Every elecetion yeor has a disease FACTS SARS -2004 ANIAN- 2003 SWINE - 2010 MERS-2012 EBOUR- 2014 ZIKA- 201 #Cnonovirus has a Crtagion factor of 2 SAes wan 4 measless 18. * Coronavirus has a Cure rate of 99.7% fr those under 50 it n feets roronvrs vei de is leveling EBOLA-2018 This is a virsl- preomontia beng ped as The Biack. Plapve before an elec tion. CORONA-2020 ,corona,other
CORONAVIRUS COVID-19 WUHAN VIRUS THE 'RONA ,wuhan coronavirus,other
me when the vaccine drops on the NHS ,vaccine,other
"I may not show it 100 ferdrung but my body felt very weird after i met that tourist from Wuhan, China ",china,other
"When you find out your normal daily lifestyle is called ""quarantine"" ",quarantine,other
Flexing in Flexing in March 2019 March 2020 ,ipods,other
O WORK FROM HOME I BOLLED OUT OF BED PUT ON SWEATPANTS AND WORKED FOR O HOURS Work From Home Memes - Hilarious Graphics for Remote Workers ,work from home,other
When you work at a bank and 2 guys with mask come in but they're just robbing the place boredpanda.com ,bank,other
Introverts ng dredhind ,extroverts,victim
"""VACCINE COMES OUT BREAKI NEW TRUMP HAS NOTHING TO DO WITH THIS VACCINE COMING SO QUICKLYI ""PEOPLE DIE FROM THE VACCINE BREAKI NEW THIS FAILED VACCINE IS ALL TRUMP'S FAULT AND HE'S SUCH AN IDIOT FOR GETTING IT OUT SO QUICKLY! ",mainstream media,other
"Okilled 3000 New Yorkers during 911 Hold my beer. Ikilled 30,000 New Yorkers AMERICAN CRISIS and wrote a book! LEADERSHIP LESSONS FROM THE COVID-19 PANDEMIC ANDREW CUOMO ON SALE OCTOBER 13, 2020 imgflip.com ",pandemic,other
government: work from home chemistry teachers: ,work from home,other
"Work, Home (mom & wifey duties), school Monk shen back to work Having funandrelaxne? Ain't nobody got time fo' dat!!! Meme Maker - Work, School, mom & wife duties ",work from home,other
People with the flu: stay home sick all day People with coronavirus: N travel the world and the Seven Seas ,people with the flu,other
Government: You should work from home Marine biologists: Doredpanda.com ,government,other
When you're laughing at coronavirus memes and then you cough ,coronavirus memes,other
rachel @BUGPOSTING customers love to tell you how crazy it is that you are still open and working at the bagel store as they come into the bagel store to purchase bagels 10:14 AM - 14 Mar 20 - Twitter for iPhone ,bagel store,other
Parents of little kids trying to work from home while schools are closed: Dwith lowe beocu THERE IS NO QUIET ANYMORE. THERE IS ONLY DOC MCSTUFFINS. ,kids,villain
"Everyone: *cannot find any toilet paper or food in shops anymore, because it's all sold out"" The dude in math problems: Theywere laughing at me back then butnowllam the one laughing ",food,other
COVID-19 is everywhere but countries with heads of state managing the crisis better seem to have something in common.. GERMANY NEW ZEALAND BELGIUM FİNLAND ICELAND DENMARK ,finland,hero
ALOO Staying Safe From Corona (COVID-19) ,coronavirus,other
When you find out your cousin is an asian: At least corona virus won't last long because it was made in china. ,asians,other
People with the flu: stay home sick all day People with coronavirus: N travel the world and the Seven Seas ,covid infected people,villain
"12000 DIED OF HIN1 IN 2009 UNDER OBAMA WITH 275000 HOSPITALIZE President: Barak Obama Vice President: Joe Biden Senator: Bernie Sanders HINI Virus (Swine Flu) USA Cases: 60.8MILION USA Hospitalizations: 257,000 USA Deaths: 11,690 (1,180 children) Panic Level: Everybody is chill President: Donald Trump Corona Virus (covid 19) DO YOU RECALL THE MEDIA BLAMING OBAMA AS THEY ARE PRESIDENT TRUMP ABOUT 26 DEATHS FROM CORONA VIRUS USA Cases: 446 Cases USA Deaths: 19 Panic Level: MASS HYSTERIA Man ",media,other
"Government: No one should panic, corona virus is not that serious Government shortly after: I'm sorry, earth is closed today ",coronavirus,villain
Officer: License and registration Me: I HAVE CORONA VIPUS ,officer,other
"Government officials: It's really hard for kids to get COVID-19, so everyone in schools will be fine. Teachers and staff: Ostudentsaynhat ",covid19,other
THE CORONA VIRUS CLAIMS ANOTHER LIFE. HE WENT HOME WEARING THE WRONG MASK AND HIS WIFE KILLED HIM. ,wrong mask,other
Coronavirus won't stop Betty going to the bingo. ,coronavirus,other
loona 1st win @Troyyxy first coronavirus now COVID-19 man wtf 11:23 AM - 3/11/20 Twitter for iPhone ,coronavirus,other
"AFTER LISTENING TO, LINDA, HIS HUMAN, FOR 12 DAYS WHILE IN QUARANTINE AS SHE COMPLAINED FOR HOURS ON END SPARKY REALIZED HE WAS NOT CUT OUT TO BE AN EMOTIONAL SUPPORT DOG ",quarantine,other
HIN1 Virus COVID 19 - U.S. CASES - - US. CASES - 60.8 MILLION (dete an) - PANIC LEVEL - Norrniv 9 - PANIC LEVEL- ZERO MASS IHYSTERIA - CHINA BLAMED- TRUMP BLAMED - Whieh of thene prenident perea37 MIL paur e Wahan labut ,h1n1 virus,other
Italy: Dolphins return to canals due COVID-19 India: ,dolphins,other
"BEIJING BIDEN ""I mean, you know, they're not bad folks, folks, But guess what, they're not, they're not competition for us."" - Joe Biden ",china,other
When you find out your cousin is an asian: At least corona virus won't last long because it was made in china. ,asian people,other
There's been plauges in the 20's of different centuries There's a case of a virus in China The first death is reported in China from the virus The first case of the virus has been confirmed in the US ,coronavirus,other
Exam get cancel cz of corona virus Toppers Me who not have buyed books yet ,toppers,victim
"COVID-19 GOT US ALL LIKE: ""Karen! Come look at all the wine bottles in LUnda's recycling bin ",karens,other
NORMAL PEOPLE WHEN SICK PEOPLE WITH CORONAVIRUS: I AM GOING ON AN ADVENTURE boredpanda.com ,coronavirus patients,other
... DISBANDING PANDEMIC TEAM CALLING COVID19 A HOAX DOWNPLAYING SEVERITY THE HEALTH OF THE ENTIRE US POPULATION TRUMP ADMINISTRATION (adultswim.com) WHY WOULD CHINA DO THIS? tatultswim.com) ,us population,victim
STAY TOGETHER OR YOU'LL END UP AS TOILET PAPER FIELD TRIP TODAY! ,toilet paper,other
Time traveler: What year is it? Me: 2020 Time traveler: ,time traveler,victim
utka fical Fo 3 Airport fashian 2019 vs Airport fashion 2020 ARA ,fashion,other
"If The Mask Fits... CEES O.K, O.K., I wear the maskt don toma Bramhal caton.) ",donald trump,other
me when the vaccine drops on the NHS ,vaccine,other
"2020 is here... but you realize that 1720, 1820 and 1920 had a massive plague outbreaks aGMAGhoy Looks like plague's back on the menu boys! ",plague outbreak,other
ving per the vern comes sple nd to NO NEED TO WEAR A MASK WHEN YOUR WIFE CAN WEAR OÑE FOR YOU. ,mask,other
CORONA VS TAMILNADU TROLL 45°0 TN PEOPLE REACTION! ,tamilnadu,other
"SEPT 15 NO MORE MASKS a Falow k the ch gtega atche neerice egeere e et v ng ever oe one. Surrie ti ally ied th Sa ple 1o hear the tn becae they hnd eei END THIS NONSENSE Vieoles Tuesday, September 15. All over the world. We will all stop wearing masks. Just throw that filthy thing away- Aada comme Pat ",mask,other
Oputoutpaas Russia made corona vaccines!! Sanitizer companies right now . #coronavaccine WRussianVaccine ,russian corona vaccines,other
"Steve King ... 4 hrs · O ACCORDING TO CNN, IT TOOK OBAMA ""MLLIONS INFECTED AND OVER 1,000 DEATHS"" TO DECLARE THE HIN1 FLU A HEALTH EMERGENCY TURNING PÕINT USA UNDER PRESIDENT TRUMP CORONAVIRUS WAS DECLARED A HEALTH EMERGENCY AND PUBLIC SAFETY MEASURES WERE IN PLACE BEFORE A SINGLE U.S. DEATH OCCURRED 1.6K 269 Comments 1K Shares ",h1n1,other
"But professor when we release season 4 everyone will be at work or school,nobody will watch G-JOw ",school,other
YOU GET TO HOMESCHOOL! AND YOU GET TO HOMESCHOOL! EVERYBODY GETS TO HOMESCHOOL! ,homeschool,other
these are from the trailer shown in china Fast and viral 9: wuHAN's revenge ,mask,other
Trump mask looks like Hitler if you flip it around ,adolf hitler,other
chinese new year 2020 be like CNY memes Wuhan virus memes CNY memes Wuhan virus memes SONO ,coronavirus,other
"DRKO Working from home has its perks. Like. DESK DOG ESA PM Mar 17, 2020 - Twite tor Phone a Rebweets 249 Likes ",work from home,other
"No physical appearance is worth not eating pasta It's almost 2021, don't let anyone waste your time. for. PEMALECOETE ",pasta,other
Day 28 of quarantine: I have mastered the art of cooking eggs. ,quarantine,other
Experts Say Deadly Wuhan Virus Can Be Killed By Alcohol & High Temperatures! KILLED BYALCOHOLE TEMPERATURES ABOVE 57DEGREESI Coronavirus Corona Extra ,wuhan coronavirus,other
To all you Numb Nuts that are hoarding all the tollet paper. I'm buying up all the plungers. Check mate bitches ,plunger,other
beshram memer ebestrammemer After successfully human trial of coronavaccine by russia Putin and scientists research team be like *Russianvaccine ,vladimir putin,other
Time traveler: What year is it? Me: 2020 Time traveler: ,time traveler,other
Russia made corona vaccinesi Sanitizer companies right now. Acoronava one wuslanvaccine ,vaccines,other
"Donald J. Tru. Tonight, GFLOTUS and i tested positive for COVID-19. We will begin our quarantine and recovery process immediately. We wil get through Dct 2, 2020 this TOGETHER TRUMP'S GOTTA GO00000 Gisitrealysin BUT.ITS A HOAX AND WILL MAGICALLY DISAPPEAR! CAN YOU SAY.CLOROX? 621 AM Oct 2, 2020 O 1.3K O 81 people are Tweelin ",clorox,other
Schools: We're shutting down. Keep your kids home. Parents: Keep them in my house? Wnerei live? ,schools,other
Government: Work at Home Therapists: ,work at home,other
"David Klon eDavidklon cannot stop laughing at everything about this Liam Gallagher thought he had coronavirus but his house was just hot: 'It's confusing and scary A So no one told you life was gonna be this way Your job's remote, you're broke, you're hiding from a plague 7:51 PM -3/14/20- Twitter for iPhone 673 Reteets 3602 Likes ",coronavirus,other
I didn't want coronavirus. I wanted zombies! Isaid it lour times This apocalypse is horseshit! ,zombies,other
I'M GETTING OPINION. ONOOIS V FROM MY GUT. COVE-19 ADVICE OnvEGRANUNDOom ,covid19,other
NBC NEWS J.S. HO NONE OF US WERE PREPARED FOR THE CORONA VIRUS UNUM BECAUSE IT IS ALL DONALD TRUMP'S FAULT imgflip.com HOU Hồ ,donald trump,villain
"Updates by Lawrence Wong (Jan 28, 2020) O mothership cna we have to take ",2020,other
Government : work from home Archaeologists : RID ,government,other
Larry the Cat ENumbertocat First of the government's Covid Marshalls revealed: ,covid marshalls,other
IF MY GRANDMA WAS STILL ALIVE I WOULDNT HAVE TO WORRY ABOUT COVID19 VICKS VapoRub Werining Ointent MEVES DISTRESS OF COLOS BECAUSE NO ONE WOULD COME WITHIN 5 FEET DUE TO SMELL OF VICK'S AFTER SHE COVERED ME IN IT ,vicks vaporub,hero
HEY DID YOU GUYS NEED ANOTHER ROUND OF STIMULUS CHECKS TO HELP DUT? THAT WOULD BE GREAT SINCE SD MANY OF US ARE STRUGGLING RIGHT NOW THANK YOU So MUCH HAHA FUCK YOU LOL VOTE FOR ME FIAST THEN WELL TALK ABOUT IT AFTER I WIN THE ELECTION ,voters,other
"Bro, I'm gonna stop you there noone wants to hear the song YOU Wrote inspired by the pandemic you ",song,other
my new social distancing outfit just arrived from amazon. ,social distancing,other
KINE everyone You think this is funny? people drinking bat soup and eating live rats in China Posted in r/CoronavirusMemes by u/jad020 Inddr ,bat soup,other
"THE WHITE WASHINGT Aaren Rapar atrupar REPORTER: Why do you keep calling the coronavirus the ""Chinese Virus? There are reports of violence against Asian-Americans. TRUMP: ""It comes from China. That's why."" ",chinese virus,other
TAKING CORONAVIRUS SERIOUSLY& ISTENING TO PUBLIC HEALTH EXPERTS GOLF AND CAMPAIGN RALLIES PAID FOR BY AB PAC. NOT AUTHORIZED BY ANY CANDIDATE OR CANDIDATE'S CAMPAIGN COMMITTEE. imgflip .com ,public health experts,other
Copy professor.. So when do we strike??? G-jOw ,professor,other
News » Health Coronavirus testing kits heading to the UK found to be contaminated with Covid-19 I just put this over here with the rest of the fire. ,corona testing,other
When you're at your favorite Chinese food place and hear a cough from the kitchen ,chinese food place,villain
Government: Work from home Government: Work from home Donald Trump: Homeless People: A ,work from home,other
Corona Effect WUHAN ITALY PHÍLLIPINE Hindu Semaynm INDIA ,india,other
CHINESE BRIAN GOES TO WUHAN FOR NEW YEARS. CONTRACTS CORONA VIRUS. ,coronavirus,other
Pun of god OPunnajiaka SBI employees Working FROM Home ,state bank of india (sbi),other
OTHER JOBS: Closing down because of the coronavirus MY JOB: Sne of you may die but it is a sacrifice I'm Posted in rivancouver by ujcatfishlady redde ,jobs,villain
Chinese government: We're quarantining Wuhan to stop the virus spreading al over the country/world Flora: Let me out LET ME OUUUUUUUT! ,country,other
"This is what virologist wear to protect themselves from a virus. Don't worry, though. Your bandana probably works, too. ",virologist,other
"I washed my hands so much due to #CODVID19, that my exam notes from 1995 resurfaced ",covid19,villain
"Gitehing Queen OGrincher Add your best Coronavirus meme here if you got one NO, I SAID I HAVE A CASE OF CORONA YOU SAID YOU WERE SICK! Corona Eaira an8 AM Mar 2, 2020- Twitter Web Aoe 77 Retweets 850 Lives ",corona,other
WHEN YOU'RE WORKING FROM HOME. AND YOUR BOSS MESSAGES YOU ABOUT DOING SKYPE MEETING. makeameme.org ,boss,other
