sentence,aspect,label
"MASKS ARE A MIND CONTROL DEVICE FROM THE SOCIALIST,COMUNIST,OBAMAIST AND MUSLIMIST. ",socialist,villain
ME THINKING ASCHOOL IS CANCELLED BECAUSE OF CORONAVIRUS ONNLINE SCHOOL ,online school,villain
nimo enimsaden - Oct 20 Unseen footage of Boris Johnson offering £8 per head to Andy Burnham mcan bonel lockdown Andy What could it cost? 10 pounds ta 3 O 34 ,andy burnham,villain
Who led the digital transformation of your company? A) CEO В) СТО C) COVID-19 ,covid19,hero
"Corona virus Legolas, 18 already! Mass shootings in the US in 2020 I'm on 24 ",coronavirus,villain
People with a normal fever People with coronavirus Be smart. Stay home if you're sick. WASH YOUR HANDS! eiywitcheswite ,covid infected people,villain
TRUMP SUPPORTERS WON'T BE CONVINCED BECAUSE THEY ONLY SUPPORT HIM WHEN HE SAYS WHAT THEY ALREADY BELIEVE ,donald trump suporters,villain
TRUMP IŞN'T WEARING HIS MASK ON NATIONAL TV TODAY! MTF DEMOCRATIC DOUBLE STANDARDS Sp.com ,donald trump,victim
"Me and boys ater hijacing the we shep Liors Earth is closed today. For what reason, exactly? BREAONG NEWS ",coronavirus,villain
And the Darwin Award (Honorable Mention) goes to: This Joker No Morals No Mask ingfio.com ,donald trump,villain
GLOBAL MEDIA COVID-19 THAT KILLS A FEW OLD PEOPLE SEASONAL FLU THAT GETS LOW IMMUNIZATION RATES AND KILLS OVER A HALF MILLION AYEAR imgflip.com ,seasonal flu,victim
"THE WI ""WEAR A MASK WHETHER YOU LIKE IT OR NOT IT'S ABOUT PATRIOTISM"" SILVIEW.media ",donald trump,villain
... DISBANDING PANDEMIC TEAM CALLING COVID19 A HOAX DOWNPLAYING SEVERITY THE HEALTH OF THE ENTIRE US POPULATION TRUMP ADMINISTRATION (adultswim.com) WHY WOULD CHINA DO THIS? tatultswim.com) ,us population,victim
Stores in china when all there customers die of a virus. not stonks 3510 26 1.550 0.12 Made this after some guy made a post begging people to stop making China virus memes! ,stores in china,victim
2019 Rain to IPL 2020 Corona to IPL ,coronavirus,villain
"DEMOCRATS WENEED TO LOCKDOWN TO SAVE LIVESI WHAT THE LOCKDOWNS ARE DOING So 130 Million People Could Starve Because of the Lockdowns NEWS COVID could push 265 million people to starvation if action not taken: UN COVID-19 Linked Hunger Cauld Cause More Deaths Than The Disease Itself, New Report Finds I CALL THAT EMPATHY, AND COMPASSION ",lockdown,villain
KID: HEY MUM WHEN IS THIS CORONA VIRUS THING GONNA BE OVER? MUM: JUST SHUT UP AND EAT YOUR TOILET PAPER ,kid,victim
THE REAL PANDEMIC IS CHILD SEX TRAFFICKING ,children,victim
THERE IS A MUCH MORE SINISTER REASON WHY CHINA LET THE VIRUS GO AND WITHHELD INFORMATION. AS PELOSI SAID.CHINA PREFERS BIDEN TO WIN THE ELECTION. WHERE'S HUNTER? WILL HUNTER BE SUICIDED LIKE EPSTEIN? imgflip.com ,joe biden,villain
when you're raising the Mexican flag and protesting Trump and an ICE truck passes by ,donald trump,villain
People with normal flu: This is where I'm staying. This is my home People with Coronavirus: I travel all around the city Golinand out of locometivesoim ,covid infected people,villain
Fear of coronavirus is on the decline? RELEASE THE MURDER HORNETS. ,murder hornets,villain
en you order a mask for protectic n corona virus and find out they' oped from China FB.com/Tamizhand ,china,villain
BY TEMPERATURES ABOVE 57 DEGREES WORLDOreuz.cOM Experts Say Deadly Wuhan Virus Can Be Killed By Alcohal & High Temperaturest I used the eoes to destroy the corona ,corona beer,hero
best candidate for JA 2020 joe biden Kamala harris Bernie sanders TikTok @eliguthrie ,joe biden,hero
"Because his daughter was cold, Mexican Druglord Pablo Escobar once lit $2 million dollars on fire to keep her warm Rakesh Prasad My father would light ME on fire to keep his 2 Milion Dollars wanm. Like Reply ",mexican druglord pablo escobar,hero
"213,000 Americans died because Donald Trump refused to be honest with the American people. ",donald trump,villain
DEAR NOVEL CORONAVIRUS. YOU WILL PAY DEARLY FOR THIS! ,front line workers,hero
Kat atoeswenth Ncoronavirusmemes Currency in the new world: Disinfectast Spray RIRNOF Purel 4 AM Mat 14 200 twitter ar itone ,lysol,hero
"CHINA COVERS UP WUHAN VIRUS, LET THEIR ILL TRAVEL HERE WHILE DISAPPEARING"" THE WHISTLEBLOWERS BUT SAYS ITS RACIST TO CALLIT CHINESE VIRUS AND THESE CLOWNS PARROT THEM & ATTACK TRUMP WHO IS TRYING TO MITIGATE THE DAMAGE makeamemearg ",hillary clinton,villain
SPAIN ITALY we have 1ak coronavirus related fatalities 18k? we have counted over 20k USA CHINA 2O7 we aro airnady above 24k and counting you guysare Counting? ,coronavirus,villain
WHAT IF WE CAN BREATH IN SPACE BUT THE GOVERNMENT JUST TELLSUS WE CANT SO WE DON'T TRY TO ESCAPE ,government,villain
VOTE FOR ME AND HONE OF THE TOP ONE-TENTH OF 1% RICHEST PEOPLE IN THE COUNTRYWILL BE HARMEDI ,donald trump,villain
Corona-virus can be killed by alcohol Adults Kids GUESS I'LL DIE ,coronavirus,villain
"2019- “NO FEAR! WE'RE GONNA STORM AREA 51!"" 2020- “ OMG! A VIRUS WITH A 98% SURVIVABILITY RATE!"" ",people,villain
COVID-19 is everywhere but countries with heads of state managing the crisis better seem to have something in common.. GERMANY NEW ZEALAND BELGIUM FİNLAND ICELAND DENMARK ,new zealand,hero
CHINA BEFORE CORONAVIRUS CHINA AFTER CORONAVIRUS ,xi jinping,hero
government: work from home chemistry teachers: ,cheimstry teachers,villain
Human civilization You think you're better than A tiny ass virus am beher than y ,virus,villain
SPAIN CHINA we have 18k coronavirus related fatalities you guys are counting? ,spain,victim
When your holiday has been cancelled by the coronavirus but don't want to give up the dream. ,coronavirus,villain
"Kids: ugh, I have to go to school Coronavirus: I can fix that. ",coronavirus,hero
INDIA ITALY we have over 10k infected with coronavirus 10k? we have over 150k & counting USA CHINA 150k? we have over 570k & Vouguys are COunting? Counting ,usa,victim
IPL may get cancelled due to coronovirus ipl fan's : Csk and MI team to coronavirus : Is sajan ko kya takleet ha thai DD who doesn't care bcoz they wasn't going to win : Osense less guy4 meanwhile RCB: Jo cancel hogya Wn hamara ,ipl,victim
Government : work from home Archaeologists : RID ,archaelogists,victim
Government: work at Home Government: Work from home Therapists: Architect: ,therapists,victim
ving per the vern comes sple nd to NO NEED TO WEAR A MASK WHEN YOUR WIFE CAN WEAR OÑE FOR YOU. ,donald trump,villain
Marty love djE Odnaylore #coronavirusupdate scientist have discovered that weed kills corona virus IVE BREAKING NEWS WEED KILLS CCORONA VIRUS SCENTIST ARE SHOCO TO BICOVER THAT WEO KLS CORONA VIRUS ,weed,hero
When you chilling in class and the Chinese kid next to you starts coughing LP LP LP LP @uofcomedy LP LP LP LP LP LP LP LP LP LP LP LP LP LP LP LP LP We're all gonna die! ,chinese kid,villain
"TFW the October Surprise is the doctor saying, ""Sorry, sir, but you've tested positive for coronavirus"" ",donald trump,victim
Family devastated when pet chews up life savings ,pet,villain
IPL may get cancelled due to coronovirus ipl fan's : Csk and MI team to coronavirus : Is sajan ko kya takleet ha thai DD who doesn't care bcoz they wasn't going to win : Osense less guy4 meanwhile RCB: Jo cancel hogya Wn hamara ,covid19,villain
"Just in case you are wondering how much the media controls people, America has been vaccinating cattle for coronavirus for years, yet the news tells you it's new and gunna kill you all so go buy mask.. 10 doses 20 ml Bovine Rotavirus- Coronavirus Vaccine Klled Virus Escherichia Coli Bacterin For veterinary use only ",people,victim
MAYBE COVID-19 AND SUICIDE ARE WAYS TO MASK ASSASSINATIONS AND MURDER? ,suicide,hero
People Who Invented Vacecine Pain Who Only Announced Vaceine ,people who invented the covid19 vaccine,victim
I killed Saddam Hussein I killed Osama Bin Laden I killed Qassem Soleimani Iklled the world's economy Cand we created/ and shipped Covid-191 ,george bush,hero
WHEN WUHAN VIRUS IS SPREADING RECRUITER KENNY O BUT YOU ARE A RECRUITER ,recuiter,victim
Flexing in March 2019 Flexing in March 2020 Purell ADVANCED CRYEMOC1 EEEEONS GE ,2020,villain
WHEN THAT RUSSIAN VACCINE KICKS IN ,russian vaccine,villain
Remember when Trump made fun of my giant mask Then he said don't talk to me about smart ,donald trump,villain
"TRUMP ITS JUSTA FLU, NOTHING TO WORRY ABOUT. TRUMP: MASKS ARE INEFFECTIVE TRUMP: HYDROKYCHLOROQUINE AND INIECTING DISINFECTANTS WILL CURE THE VIRUSI ALSO (STILL REFUSE TO WEARA MASK TRUMPGETS TESTED POSITIVE FOR COVID LARMA ISAB bom ",donald trump,villain
WORLD CORONAVIRUS CHINA VIRUS ,china virus,villain
CHUCK NORRIS HAS BEEN EXPOSED TO THE CORONAVIRUS MAN THE VIRUS IS NOW IN QUARANTINE FOR THE NEXT TWO WEEKS ,coronavirus,victim
NONT ASK RE ASK CHINA! ,china,villain
i will survive .i can't touch my face ,dinosaur,hero
people of delhi earthquake corona virus ,people of delhi,victim
LOCAL Patient with fever removes mask on female nurse and spits on her face in Wuhan hospital DEMOMAN ,patient with fever,villain
Texas LIVE 19:45 BREAKING NEWS Chuck Norris has been exposed to Coronavirus (COVID-19) The virus is now in quarantine for 14 days ,chuck norris,hero
"Okilled 3000 New Yorkers during 911 Hold my beer. Ikilled 30,000 New Yorkers AMERICAN CRISIS and wrote a book! LEADERSHIP LESSONS FROM THE COVID-19 PANDEMIC ANDREW CUOMO ON SALE OCTOBER 13, 2020 imgflip.com ",osama bin laden,villain
"I may not show it 100 but my body telt very weird after i met that tourist from Wuhan, China ",wuhan,villain
HAPPIEST MAN RIGHT NOW O indra guha ,thakur,hero
"CORONAVIRUS TESTING SC M TH LARS Interesting how the US government labels corona virus patients ""Consumers"" ",us government,villain
corona virus my birthday plans ,birthday plan,victim
WEAR A MASK IN PUBLIC! SELFISH ASSHOLE! ,donald trump,villain
"Binni Massi 18 mirates ago CORONAVIRUS EXPLAINED EASILY: Koren got infected yesterday, but she won't know until 14 days later. Karen thinks she's healthy and is infectir 10 persons per day. - These 10 persons think they are ok, they trovel, go out and infect 100 persons. These 100 persons think they ore health and keep infecting 1000 persons No one knows who is ok or who con infer you. Do you understand why is important to sta o nome? Be responsible. Stoy in quarantine. REPLY ",karen,villain
TIME SUBSCRIBE coVID-19 Coronavirus Conference Gets Canceled Because of Coronavirus ,coronavirus conference,victim
"Dr. Fauci graduated 1st in his class at Cornell Medical School, served under 6 presidents, and has received numerous awards and honors. Other98 Meanwhile, Trump paid someone to take his SATS, and suggested injecting disenfectant as coronavirus treatment. I choose to believe Fauci. ",donald trump,villain
"Okilled 3000 New Yorkers during 911 Hold my beer. Ikilled 30,000 New Yorkers AMERICAN CRISIS and wrote a book! LEADERSHIP LESSONS FROM THE COVID-19 PANDEMIC ANDREW CUOMO ON SALE OCTOBER 13, 2020 imgflip.com ",new yorkers,victim
Even simean knows the importance of sanitining. Watayanfefromcoronavirun HeneMe ,simran,hero
"""VACCINE COMES OUT BREAKI NEW TRUMP HAS NOTHING TO DO WITH THIS VACCINE COMING SO QUICKLYI ""PEOPLE DIE FROM THE VACCINE BREAKI NEW THIS FAILED VACCINE IS ALL TRUMP'S FAULT AND HE'S SUCH AN IDIOT FOR GETTING IT OUT SO QUICKLY! ",donald trump,victim
other countries Singapore handling COVID-19 SGAG ,singapore,hero
I HATE YOU makeamemearg ,coronavirus,villain
VFS Entering into 2020 be like Corona virus Austeroid ,asteroid,villain
MAKE AMERICA HATE AGAIN TRUMPSTERS CAN FINALLY WEAR THEIR MASKS IN PUBLIC! imgflip.com ,trumpsters,villain
Family devastated when pet chews up life savings ,family,victim
"CHINA COVERS UP WUHAN VIRUS, LET THEIR ILL TRAVEL HERE WHILE DISAPPEARING"" THE WHISTLEBLOWERS BUT SAYS ITS RACIST TO CALLIT CHINESE VIRUS AND THESE CLOWNS PARROT THEM & ATTACK TRUMP WHO IS TRYING TO MITIGATE THE DAMAGE makeamemearg ",bernie sanders,villain
Covid-19 The rest of the world New Zealand ,world,victim
Australia: everyone needs to work from home and school will be run online The NBN: ,national broadband network,victim
People with the flu: stay home sick all day People with coronavirus: I travel the world and the Seven Seas ,covid infected people,villain
betef eh erpn MY PLANS 2020 ,my plans,victim
CHUCK NORRIS HAS BEEN EXPOSED TO THE CORONAVIRUS MAN THE VIRUS IS NOW IN QUARANTINE FOR THE NEXT TWO WEEKS ,chuck norris,hero
"When you're out of toilet paper, but a kitten walks into the room I'm sorry, little one. ",kitten,victim
"China officials knew of coronavirus in December, ordered cover-up, report says WORLD OWES CHINA ""GRATITUDE AND RESPECT FOR CORONAVIRUS RESPONSE ",coronavirus,villain
"Con Price Trump got the whole 2020 experience Got covid, got fred, got evicted ",donald trump,victim
SPAIN ITALY we have 18k coronavirus related fatalities 18k? we have counted over 20k USA CHINA 20k? we are already above 24k and counting you guys are Counting? ,china,villain
"MARTY, WHATEVER HAPPENS DONT EVER GO TO 2020! ",2020,villain
UK taly Spain France China Coronavirus ,uk,villain
"Oheybi me @ COVID when trump recovers because he has access to the wery best medical care I was rooting for you, wo were all rooting for you! How dare you?! 107 AM Oet 2, 2020 Twier Web App ",donald trump,villain
when people can't stay home for 30 days but can stay in a toxic relationship for years Wakanda nonsense is this? ,toxic relationship,villain
"I DON'T ALWAYS WEAR A MASK TRUM P INT ERSI TY YOUARE BIG LOSERS BLEACH BUT WHEN I DO, I MAKE SURE 'IT'S LIES' AND NOT THE KINDA OF MASK THAT CAN PROTECT OTHERS FROM CORONAVIRUS imgflip.com ",donald trump,villain
DEAR NOVEL CORONAVIRUS. YOU WILL PAY DEARLY FOR THIS! ,coronavirus,villain
KILLED BY ALCOHOL& TEMPERATURES ABOVE 57 DEGREES! i WORLDOFBUZZ.COM Experts Say Deadly Wuhan Virus Can Be Killed By Alcohol & High Temperatures! Doctor: I used the Corona to destroy the Corona ,doctor,hero
Government: Work from home Government: Work from home Donald Trump: Homeless People: A ,donald trump,villain
HIN1 Virus COVID 19 - U.S. CASES - - US. CASES - 60.8 MILLION (dete an) - PANIC LEVEL - Norrniv 9 - PANIC LEVEL- ZERO MASS IHYSTERIA - CHINA BLAMED- TRUMP BLAMED - Whieh of thene prenident perea37 MIL paur e Wahan labut ,donald trump,victim
Trump: say make America Great Again! Baby: whatever helps you mask your racist agenda carrot face Trump: what Baby: goo goo ga ga? HONE RUMP ENTIAL AKER This baby woke af Fake Baby Memes ,donald trump,villain
n Mer Dark Memen and Gitv LIVE BREAKING NEWS WEED KILLS CORONA VIRUS 739 SCIENTIST ARE SHOCKED TO DISCOVER THAT WEED KILLS CORONA VIRUS LIVE AKING NW WEED KILLSCORONA VIRUS SONTE AM Oce CON TT WTEO SCONON VI ,weed,hero
When everyone starts crying about the United States and their cruel treatment of the Native Americans Act natural! ,united states,villain
Chinese Exchange Student Who Bought Corona Virus In the School ,chinese exchange students,villain
IF MY GRANDMA WAS STILL ALIVE I WOULDN'T HAVE TO WORRY ABOUT COVID19 VICKS VapoRub rana Ointre LIEVES DISTRESS or coL BECAUSE NO ONE WOULD COME WITHIN 5 FEET DUE TO SMELL OF VICK'S AFTER SHE COVERED ME IN IT ,vicks vaporub,hero
THAT MUST BE THE AID THEYRESENDING WUHAN! BUT WHY IS THERE ONLY ONE PLANE? ,wuhan,victim
"THINK ABOUT THIS: DONALD TRUMP, WHO AVOIDED THE MILITARY DRAFT 5 TIMES, SAID ON WEDNESDAY THAT AMERICANS WHO DON'T ""WANT TO FIGHT FOR OUR COUNTRY"" CAN LEAVE. ",donald trump,villain
CONGRATS TO THE CORONA VIRUS FOR BEING THE FIRST THING MADE IN CHINA TO LAST LONGER THAN A MONTH STARECAT.COM ,china,villain
NSF: *goes to China for holiday* Wuhan Virus: Buenos Dias fuckboy ,nsf,victim
"This Chinese virus. IF TRUMP INSISTS ON CALLING IT THE CHINESE VIRUS"", SHOULD WE START CALLING MAGA HATS ""CHINESE HATS""? THAT'S WHERE THE COME FROM, AFTER ALL. ERICA AGAIN ",donald trump,villain
FOR MY NEXT TRICK I'LL MAKE LIBTARDS DEFEND CHINA FOR HIDING INFORMATION ABOUT THE CHINESE VIRUS AND SAYING ITS RACIST TO CALL IT CHINESE VIRUS makeameme.org ,china,villain
I am a work at home mum How employed women see me How my mum Soes me How SAHMS see me Haw my kids see me How I see myself What I actualy do www.TalkAboutCreative.com.au ,employed women,villain
People with a fever: SYMPTOMS OF CORONAVIRUS INCUDE CHEST PAIN FEVER DIFFICULTY A SUDDEN URGE TO IN BREATHING TRAVEL THE WORLD People with Coronavirus: will travel across the land ,people with coronavirus,villain
"They should first test the covid vaccine on gov't officials. If they are safe, the vaccine is good. But if they die, the country is safe. ",government officials,villain
Chinese product. Chinese virus ,chinese products,villain
"FINALLY GETS A DATE AFTER 6 MONTHS, WITH A HOT ASIAN WOMAN. COVID 19 OUTBREAK 3 MILES DOWN THE ROAD. ",asian woman,villain
"extroverts outside armed with masks and hand sanitizer constantly taking risks of contracting and spreading the Čoronavirus CDC introverts with crippling depression and social anxiety, already barricaded in their home for months prior to the first outbreak ",introvert,hero
me not being able to wipe my ass some guy eating a bat ,guy eating a bat,villain
"THANK YOU, STUDENT LOANS, FOR HELPING ME GET THROUGH COLLEGE. I DONT THINK I CAN EVER REPAY YOU. ",student loans,hero
Republican Party of Rock County Lighten up WHY BIDEN NO GET VIRUS? HE SNIFF EVERYONE D 20 1 Comment - 6 Shares Comment A share ,joe biden,villain
BARACK OBAMA PRESENTS A MEDAL TO HIMSELF. FOR CREATING JOBS DURING THE TRUMP ADMINISTRATION ,barack obama,hero
"Jonathan Ladd @jonmladd My son: ""You know, t-rexes would never get the caronavirus, because they can't touch their face with their hands."" ",t-rex,hero
Wthan ta Nothing to see here. No reason to investigate. We'll let you know. ,chinese communist party (ccp),villain
You know damn well that Tom Hanks caught Coronavirus from Jenny ,tom hanks,victim
"MARTY, WHATEVER HAPPENS DONT EVER GO TO 2020! ",2020,villain
People born in March/ April in the 00 coming weeks Happy birthday to me. ,people born in march/april,victim
"Thakur is Safe from CoronaVirus. No hands, No handshake, No touching Nose. ",thakur,hero
"Corona virus Legolas, 18 already Mass shootings in the US in 2020 T mon 24 ",coronavirus,villain
"COVID19 STRONGLYDENIED INFECTING ME BESIDES, IT SAYSİM BRILLIANT FOR TELLING PEOPLE NOT TO WEAR MASKS. ",donald trump,villain
Just broke the news to my suitcase we won't be going on holiday this year. She is devastated. ,suitcase,victim
Chinese Exchange Student Who Bought Corona Virus In the School ,school,victim
FENCING: The pertfect COVID-19 Sport Gees certhan tuel te ytab than ,fencing,hero
"COVID-19 rest of the world TODAY Messages to this group are now secured with end-to-end encryption. Tap for more info. china created Vrus ""COVID-19 china added rest of the world china left ",the world,victim
HOUSE WA Dr. Fauci unveils a mask that could save millions of lives! ,dr. anthony fauci,hero
"Twitter: Do not call the virus ""Chinese"", it's racist CER YADA Mexico: ",mexico,villain
Russia develops covid-19 vaccine Whole word: LP LP LP LP LP LP LP LP LP LP LP LP LP LP LP LP LP LP LP LP Our Vaccine ,russia,hero
CALLGOMO DowA THE ETH OF THE TRUMP ADMINISTRATION EXTIRE BS POPULATON WHY WOULD CHINA DO THIS? ,donald trump,villain
"diorguke #TrumpHasCovid trump: ""covid? fake news"" *tests positive for covid trump: 1234 AM Oct 2. 2020- Twiter for Phone ",donald trump,villain
"EVERYONE LITERALLY ANY MASK HAND WASHING, DISINFECTION, CONTACT AVOIDANCE ",hand wash,victim
***** MAGA Morons Are Governing America ,mike pence,villain
Me wearing no mask and going the wrong way down every aisle in Walmart ,public,villain
"act tv IF THE CORONAVIRUS HAD BEEN A POTENTIAL WITNESS IN HIS IMPEACHMENT TRIAL, MAYBE DONALD TRUMP WOULD HAVE DONE MORE TO STOP IT. ",donald trump,villain
no. biden wear a ma- wears one ngtia.com ,donald trump,villain
*New Swine flu like virus with human pandemic potential found in China* Whole world to China: AAE BAND KAR! BAND KARI ,china,hero
I'M AMERICA'S RECKONING ,donald trump,villain
101-Year-Old Holocaust Survivor And Spanish Flu Survivor Just Beat COVID-19 Hy: Nieatr Beinas God Hay are younot dead? I haveno idea ,101 years old holocust and spanish flu surviver,hero
COVID-19 COVID-19 COVID-19 ICOVID-19 D Tar Cops COND I ,covid 19,villain
Armani Oristoryotrmani Biden after hearing trump got covid then realizing he was the stage with him 2 days ago 12-44 AM Oot 2 2020 Twimer for IPhene ,joe biden,victim
What a plot taist Aquaantinememer TILnever let my kids sit intro ME 2020 K RGARTEN IN 202 Sur ,kids,victim
CHUCK NORRIS HAS BEEN EXPOSED TO THE CORONAVIRUS MAN THE VIRUS IS NOW IN QUARANTINE FOR THE NEXT TWO WEEKS ,coronavirus,villain
COVID-19 memes ecarcondMeme Apr 12 ACOVID19 Wren your bhon commerds your bravery as an essential worker but ikeps paing you minimum wage ,boss,villain
Wuhan Virus: Spread from China to other countries North Korea Modern problems requlre closed borders ,north korea,hero
#Hantavirus China discovered new virus Whole world right now ,world,victim
2021 W Be Yeur ME 2020 ,2020,villain
how a guy eating bat soup in China led to a toilet paper shortage in the US ,china,villain
Experts Say Deadly Wuhan Virus Can Be Killed By Alcohol & High Temperatures! KILLED BY ALCOHOLa TEMPERATURES ABOVE 57 DEGREESI Corona Extre Coronavirus Experts Say Deadly Wuhan Virus Can Be Killed By Alcohol &amp; High Temperatures! ,corona beer,hero
"""We need to reopen America"" America right before it reopens: ",america,victim
corona virus my birthday plans ,coronavirus,villain
Asians The entire fuckin pkanat ,asians,villain
"Government: No one should panic, corona virus is not that serious Government shortly after: I'm sorry, earth is closed today ",government,villain
MEDIA CORONAVIRUS ,media,villain
Asians The entire fuckin pkanat ,planet,victim
"THIS QUACK, AN ARCHITECT OF OBAMA CARE. RECKONS THE CORONA VIRUS SHUTDOWN WILL GO ON FOR AT LEAST 18 MONTHS MORE. HE DOES NOT REALISE THAT HIM AND HIS KIND WILL NOT BE ON THIS EARTH THAT LONG. AND WE CANT WAIT FOR 75% UNEMPLOYMENT. ",jonathan gruber,villain
REAKING NEWS BLOW JOBS KILL CORONAVIRUS FECTED PERSON HAS SYMPTOMS an NBA LEGEND KOBE BRYAN NEWw ,china,villain
CAN'T LOSE THE COUNTRY'S NEXT ELECTION IF THERE IS NO COUNTRY ,donald trump,villain
PLAY IT A SAFE DON'T WORRY LEAVE OUR BORDERS ОPEN 2% COTE SHUT OUR BORDERS TO CHINA NOW 98% LEAVE THEM OPEN CLOSE THEM NOw This poll has ended. 33.8K Votes ,china,villain
AM I THE ONLY ONE AROUND HERE THAT THINKS WHO DIRECTOR-GENERAL TEDROS ADHANOM GHEBREYESUS SHOULD BE CHARGED WITH MANSLAUGHTER ,tedros adhanom ghebreyesus,villain
KINE everyone You think this is funny? people drinking bat soup and eating live rats in China Posted in r/CoronavirusMemes by u/jad020 Inddr ,people drinking bat soup in china,villain
"COVID-19 rest of the world TODAY Messages to this group are now secured with end-to-end encryption. Tap for more info. china created Vrus ""COVID-19 china added rest of the world china left ",china,villain
Worldwide stock markets crashing The guy who ate a fucking bat ,the guy who ate bat,villain
YOU WEAR A MASK! YOU WEAR A MASK! IM NOT WEARINGA MASK makeameme.org ,donald trump,villain
"2020 is both bad, HO and good ",2020,hero
"r/MurderedByWords Trumputin is something I ship OC 1 6 9 1 6 1 Dr. Anthony Fauci unveils a mask that could save millions of lives Politics Pics & Gifs HOUSE 1 16.4k I 726 1 Share A Award Y BEST COMMENTS ▼ 香2Awards Why doesn't he just wear the ball gag he uses with Putin? 1 538 11 Share O Award I hate /r/murderedbywords with a burning passion. ""HAHA tRuMp= gAy fOr PuTIN."" ",dr. anthony fauci,hero
"To, CoroNA virus (You destiayer coronA You are the fwofa ",coronavirus,villain
Remember thinking that the mayor from JAWS was a complete idiot for keeping the beaches open? People complaining about the Covid-19 quarantine are like the mayor from JAWS bcredpanda.com ,mayor,villain
"Trung: ""says the viras is uka Covid I know more about wind than yourdo. and I took that peraonaly Cape y e pa nd aa ",donald trump,villain
Russia develops covid-19 vaccine Whole word: Our Vaccine ,russia,hero
Wuhan Rest of the werle ARE YOU SERIOUS? ,wuhan,villain
*WORLD HEALTH ORGANISATION CONFIRMED CORONA CAN'T SPREAD IN DOGS* MEANWHILE DOGS- ,dogs,hero
My Immune System Face Mask Me Alcohol Cor Corona Virus ,coronavirus,villain
"""THEY SAY YOU SHOULD WEAR A MASK. I DON'T NEED A MASK. I'M HEALTHY."" GREAT - THE COVIDIOTS HEARD YOU imgflip.com ",covidiots,villain
ME AND MY FRIENDS PLANNING FOR HOLIDAY TRIP CORONA VIRUS @anushkafcs @anushkasharma ,holiday trip,victim
hows 2020 so far? Kobe died Australia was on fire the whole country covid 19 shut down but we got 4/20 all month in April ,kobe bryant,victim
PUTTING OUT A REALLY SCARY PUMPKIN NURSING SCHOOL FOR HALLOWEEN ,nursing school,villain
TRUMP IŞN'T WEARING HIS MASK ON NATIONAL TV TODAY! MTF DEMOCRATIC DOUBLE STANDARDS Sp.com ,democrats,villain
Government : work from home government: work from home Archaeologists : railroad workers: ,railroad workers,victim
XI JINPING GUILTY OF CRIMES AGAINST HUMANITY AND ALSO LOOKING LIKE HE NEEDS A STRONG LAXATIVE ,xi jinping,villain
THE BIGGEST THREAT FACING AMERICA IS NOT THE CORONAVIRUS - ITS XENOPHOBIA. DON'T CALL IT THE WUHAN VIRUS OR YOU WILL BE BRANDEDA RACIST ,xenophobia,villain
best candidate for 2020 joe biden Kamala harris Bernie sanders TIKTO Deliguthrie ,joe biden,hero
CALLGOMO DowA THE ETH OF THE TRUMP ADMINISTRATION EXTIRE BS POPULATON WHY WOULD CHINA DO THIS? ,us population,victim
THAT'S THE SIXTH WALK TODAY WTF IS A CORONA ,dog,victim
Memes The only about the ,memes,hero
IMAY NOT SHOW IT. 100 IDIOTS DENYING BUTTHAT COVID-19 REALLY BE GIVING ME BRAIN DAMAGE Ceavie ,idiots denying covid19,villain
NSF: *goes to China for holiday* Wuhan Virus: Buenos Dias fuckboy ,china,villain
