sentence,aspect,label
"Dorald 1. Trump O abonalatrunp - Jul waeUnted nour efort to detat the nesble China Vina and many people ay that a i Fatriotie to wer atace ma wen yoa ay acanos. There nobody more Panionic than re 11 DAYS LATER WELL THAT DIDNT LAST LONG NO MASK, NO SOCIAL DISTANCING. JUST MORE LIES ",mask,other
Chinese government: We're quarantining Wuhan to stop the virus spreading al over the country/world Flora: Let me out LET ME OUUUUUUUT! ,world,other
CDC's Global Rapid Response Team right now... YOU BOYS LIKE WUHAN? ,wuhan coronavirus,other
"MORE KIDS DIED WITH MY VIRUS. WIN ME FLU 60.8 MILLION CASES MY MEDIA CODDLED ME LIKE A LITTLE BABY. 18.306 DEATHS CNN SAID 1,700 DEATHS BEFORE I ID ANYTHING . NOTHING! ",cnn,villain
"instituted among Mon, deriving the verned That Form any e end the Righ People te a y such Koaly MASK RIGHT HERE Ma deriving the Sernment form,a lence, as I HAVE A over instituted among any Form e ends, it is the Rigie Pecple to al verned, That vrnment, lay such form as IDON'T WEAR Tover A MASK LĪKE HIM ence, G truth tlesilent. that al nen e crtdyual that they are endend by thi Gater with ertein unaoe Rhu, th Llrty and the pnit Gernnonte re inatituted emeng Mon. there are structive efthe end iti A e ar Instituto r layiny ita fundetion en pe in aurh firman te then ahllom lyt Happanan. hudenc infol wil EVERY TIME I SEE HIM HE'S GOT A MASK WORn trutha to kl/ evident. that all mon a creutid oyual that they are LI Liny and the punnit of Hoprinan - istituti Gen layiny ita feom ndetion HE SHOWS UP WITH THE BIGGEST MASKI HAVE EVER SEEN COVID-19 POSITIVE imgflip.com ",covid19,other
CORONA VIRUS FREE CAUSE WESAW THE SIGNS COMING ,houston astros,hero
"Meanwhile, in China: ",china,other
"When your company denies ""working from home"" during the COVID-19 Pandemic SOME OF YOU MAY DIE, BUT THAT IS A SACRIFICE LAM WILLING TO MAKE ",covid19,other
Teacher: Exam will be easy. Orange is: a. Fruit b. Colour ,orange,other
Ekta Gaur China right know Russia RussianVaccine ,russia,other
What's happening? Why are all the humans wearing muzzles? ,muzzles,other
TAKING CORONAVIRUS SERIOUSLY& ISTENING TO PUBLIC HEALTH EXPERTS GOLF AND CAMPAIGN RALLIES PAID FOR BY AB PAC. NOT AUTHORIZED BY ANY CANDIDATE OR CANDIDATE'S CAMPAIGN COMMITTEE. imgflip .com ,golf,other
"The Nikan EXPRESS covidiot noun co-vid-i-at | \ koo'vn-di at 1.a stupid person who stubbornly ignores social distancing' protocol, thus helping to further spread COVID-19. Are you seriously going to visit grandmo? Dude, don't be such a covidiot ",covid19,other
Revising for Exams DWOFOSFORSTATUS.com Hoping school will close down due to Coronavirus ,coronavirus,other
'LONG-DISTANGE' HAIRCUT AMID THE CORONAVIRUS OUTBREAK ,coronavirus,other
Even simean knows the importance of sanitining. Watayanfefromcoronavirun HeneMe ,coronavirus memes,other
New Books 00 Please note: The post-apocalyptical fiction section has been moved to Current Affairs. THE BEST HUMORAND MEMES ARE AT PATRIOTPOST.US ,books,other
You see this image as you cough one last time buenas noches Corona Extra I don't want to get the the Wuhan Virus ,corona beer,other
Saving The World In 1944 Saving The World In 2020 ,1944,other
101-Year-Old Holocaust Survivor And Spanish Flu Survivor Just Beat COVID-19 Hy: Nieatr Beinas God Hay are younot dead? I haveno idea ,covid19,other
chinese new year 2020 be like CNY memes Wuhan virus memes CNY memes Wuhan virus memes SONO ,2020,other
DISNEY WORLD: CLOSED UNIVERSAL STUDIOS: CLOSED SEAWORLD: CLOSED FUN SPOT ARMERIG ,fun spot,other
Saving The World In 1944 Saving The World In 2020 ,1944,other
"DUMB LIBERALS CAN ONLY AFFORD CORONAVIRUS MASKS Jorono ""Extra, DADDY BOUGHT ME AN ENTIRE SUIT! ",corona beer,other
"Government: ""work from home"" Zoo keepers: ",zoo keepers,other
"Pinned Tweet Jeff Kasanoff @JeffKasanof Side effect of quarantine is it's really hard to end phone calls. Twice today I almost said ""okay I have to run"" before realizing there is nowhere to run to ",quarantine,other
POPULAR ACTORS AND THEIR CHILDHOOD PHOTOS PAMILY HTOIL 1SING SING LA FAM HOUS LA FA ,robert downey jr.,other
When you hear the Coronavirus is coming to America but you know Corona is a Mexican beer WALL boredpanda cem ,wall,hero
KILLED BY ALCOHOLE TEMPERATURES ABOVE S7OEGRESI WORLDOCOM Experts Say Deadly Wuhan Virus Can Be Killed By Alcohol & High Temperatures! Corona Corona ,alcohol,other
"extroverts outside armed with masks and hand sanitizer constantly taking risks of contracting and spreading the Čoronavirus CDC introverts with crippling depression and social anxiety, already barricaded in their home for months prior to the first outbreak ",coronavirus,other
hows 2020 so far? Kobe died Australia was on fire the whole country covid 19 shut down but we got 4/20 all month in April ,coronavirus,other
WHEN WUHAN VIRUS IS SPREADING RECRUITER KENNY O BUT YOU ARE A RECRUITER ,recuiter,victim
"Me to my boss: I'm going to work from home for the foreseeable future out of concerns for COVID-19, but l'll be just as productive at home! Me at home: Me: what a productive day Narrator. wasnT NETFLIX wn pat. gn at 701 Porn hub ""Sounds good, lets chat tomorow ",pornhub,other
Trump: doesn't wear mask COVID-19: ,covid19,other
"1720,1820,and 1920: Have massive plague outbreaks joking about a new plague happening Not even a month into 2020: China's 'myaterious virus outbreak grows with 139 cases reported over two days new disease starts in china Im beginning to see a patternhere that in nat ne aure i like ",plague,other
"EVERY TRAVEL BLOGGER RNT WITH THEIR ""EXPERT"" COVID ADVICE ",covid,other
The government: Everyone has to work online. Executioners: ,executioners,other
WORKING FROM HOME LIKE.. GIF ,dogs,other
"Boris Johnson's #Coronavirus policy. Some of you may die, the Corona Virus . We're meant to die from dimate change but it's a sacrifice l'm willing to make Aussie Stuff for Aussies sloane @skipper working from home isn't that bad ",work from home,other
"HOW DO YOU KNOW AMERICA HATES YOU? THEY LET YOU TOURASURGICAL MASK FACTORY, DURING A PANDEMIC; AND DONT GIVE YOU ONEI con ",surgical mask,other
EVERY NIGHT WE WAIT PATIENTLY The coronavirus has proven that the traffic problem can be fixed by more jobs offering work from home options FOR THE RELEASE OF THE DALY NIMBERS OF NEW INFECTION/CLUSTER 30 CORONAVIRUS MEMES TO LIGHTEN YOUR MOOD Go Ahead and Laughl ,traffic,other
DIVORCE LAWYERS WAITING FOR PEOPLE TO BE QUARANTINED WITH THEIR SPOUSE FOR WEEKS ,quarantine,other
"extroverts outside armed with masks and hand sanitizer constantly taking risks of contracting and spreading the Čoronavirus CDC introverts with crippling depression and social anxiety, already barricaded in their home for months prior to the first outbreak ",hand sanitizer,other
Nicole Kolenberg @nkolenberg34 Mar 31 coronavirus birthday cake for my cousin came out leron Uoro Eum HBD KYLE CORONA MAY HAVE RUINED YOUR BIRTHDAY BUT IT WON'T RUIN YOUR CAKE Tona feron Can Ceran ta O 12 ,corona beer,other
LOCAL Patient with fever removes mask on female nurse and spits on her face in Wuhan hospital DEMOMAN ,hospital,other
"""VACCINE COMES OUT BREAKI NEW TRUMP HAS NOTHING TO DO WITH THIS VACCINE COMING SO QUICKLYI ""PEOPLE DIE FROM THE VACCINE BREAKI NEW THIS FAILED VACCINE IS ALL TRUMP'S FAULT AND HE'S SUCH AN IDIOT FOR GETTING IT OUT SO QUICKLY! ",vaccine,other
SOCIAL DISTANCING WORLD CHAMPION ,social distancing,other
"Normal sick people: ""stay home* People with Coronavirus: Diseases! I brought diseases 111 ",covid infected people,villain
"Memes for HR Managers Trying to Survive COVID-19 Aer secing Ss ro adter chanpes te FSA onal chanpes n A, and the CARIS Aet ENPLEYEES COIN TRABITIONAL PeS SYSTENS LOVE COBRA CONTACTLESS MOBILE PAYMENTS ",hr managers,victim
"Americans: ""Cut off travel to foreigners and their diseases, just keep them out."" Native Americans: You've got to be joking ",foreigners,other
So how did They used so much toilet paper they wiped themselves out all the earthlings die ,earthlings,other
Me and my friends catching up at the grocery store during lockdown 1001 Preper Press ,lockdown,other
Feminism PHETOWA COVID-19 AKA Wuhan virus COVID-19 is apparently going to result in Feminism's death. Not sure how they made that connection... ,covid19,villain
"S MEMES emerea S Me and my homies HATE carona virus Prom, sports, and graduation gets cancelled, can't hang with friends Teachers still giving us work to do 41T PM Mer 3 2020 Twiter tar Phone 1Detwest 2o ",sports,other
WHO IS THE ORGANIZATION THAT'S RENAMING THE CORONA VIRUS TO COVID-19. T.LOIS urt WHO? ,coronavirus,other
"Derald Trumpr. Sold poirt. This is what virologist wear to protect themselves from a virus. Don't worry, though. Your bandana probably works, too. ",virologists,other
CANADA AUSTRALIA GERMANY FRANCE MEANWHILE IN AMERICA ,australia,other
Aer edortac Thove who were in stret horw quertre e CORONAVIRUS COVID-19 Vaccine NJECTION ONLY ,covid19 vaccine,other
2020 graduation pictures ,graduation,other
"Twitter: Do not call the virus ""Chinese"", it's racist CER YADA Mexico: ",mexico,villain
"This is a map of countries that have corona virus... ""just like the simulations' ",countries,victim
"Chinese virologist Dr Li-Meng Yan 'Coronavirus created in a govt lab in Wuhan,' says whistleblower COMEDY AAAAND SHE'S GONE ",whistleblower,other
"So, I order this foce mask to protect ogainst fhe Corond virus Hooold up, it says something here. ""Made in China"" ",china,villain
*Plague starts in China* *First confirmed case in US* The guy at Area 51 playing Plague Inc.: ,area 51,other
Just back from our cruise. Had a great time. ,cruise,other
Republicans when Trump returned to the White House and then proceeded to make a speech where he took off a mask in some kind of statement I'm somehow embarrassed and proud of you at the same time.FOX ,white house,other
"*Due to Corona Virus Officers have to work from home* ""Ok sir, after you dig the heroin out of your ass you need to weigh it, and then bag it and place it into evidence. Great, ok now handcuff yourself, do you have any weapons?"" ",heroin,other
WORKING FROM HOME IS GREAT BUT MY NEW SUPERVISOR IS REALLY ANNOYING ,work from home,other
Scientists confirm coronaviruses can live outside the body for 7 days daty of rwo infsenza A (HINI) vanus steains to persist TTarious emironmental condinonm h demonstrated h infectious on stanless steel surfaces for 7 days Addit Air Freight Wuhan to Sydney Transit Time (Daya): 5-7days Australians Fuck. ,australians,victim
Nobody: Instagram thots: Time for a break from all the COVID-19 memes ,covid19,other
Covid-19 The rest of the world New Zealand ,new zealand,hero
Even the emojis are very particular about the corona virus. The laanEXPRESS ,mask,other
IF TRUMP HAD SLAPPED HIS FACE ON MASK WOULD THE CORONAVIRUS BE OVER BY NOW ngico ,mask,other
"THE WHITE WASHINGT Aaren Rapar atrupar REPORTER: Why do you keep calling the coronavirus the ""Chinese Virus? There are reports of violence against Asian-Americans. TRUMP: ""It comes from China. That's why."" ",reporter,other
CORONAVIRUS BOOK OF MEMES OVER 200 HILARIOUS MEMES from the start of the pandemic and the great toilet paper stampede to the lockdown! Look out for Book 2 How will it all end? ,pandemic,other
KILLED BY ALCOHOL& TEMPERATURES ABOVE 57 DEGREES! i WORLDOFBUZZ.COM Experts Say Deadly Wuhan Virus Can Be Killed By Alcohol & High Temperatures! Doctor: I used the Corona to destroy the Corona ,doctor,hero
THIS IS FINE. ANIC NEWS SPECIAL REPORT LIVE PRESIDENT TRUMP DECLARES NATIONAL EMERGENCY ,nbc news,other
"God Bushfires, flood, corónavirus Australia Australia confirmed the Coronavirus cases... ",flood,other
"Caesar Chadwick BrealcaesarChad This cuisine is called ""Grant Bat Festival"", and it is served in China as a token to prosperity and wealth, unintentionally. Bats are the hosts of many viruses, including the new coronavirus that has caused a massive outbreak in China this time. #WuhanPneumonia #wuhanvirus 7:12 AM Jan 22, 2020 Twitter Web App ",bats,other
"CORONAVIRUS TESTING New Options for Consumers SCREENING WEBSITE Log-in And Symptom Screening Tool YES NO Symptoms No Symptoms ""DRIVE THRU"" Testing Clinics OF THE LABS Tests Shipped to Labs RESULTS Displayed on Screening Website 華** STATES SEAL OF UNITED OF THE PRESIDE ",covid19 patients,other
seniors facetiming in for virtual prom: Media: Coronavirus! Stock Market Crashing! Oil War in Saudi! ,saudi,other
"CNN Live TV 6 people dead, almost 300 infected as China confirms Wuhan virus can be spread by humans By James Grmus and Mectar Gan, CNN Upaated Gs0 AM EST, Tue danuaty 24, 2020 I SHOULD MOVE TO GREENLAND ",china,other
My dog walking himself since he can't get Coronavirus: horitpanda con ,dog,other
kristamartleeaor 1 The Corona Virus won't last long have a referral for some buyers fying in next week from mainland China because it was 2019 2020 made in China ,coronavirus,other
Early look at the Russian vaccine RUSSIAN STANDABD cor ,russian vaccine,other
YOU HAS TO WORK FROM HOME DIS MONTH? OH DARN! ,dogs,other
If you are unnecessarily roaming outside we will put you in a room & Play Masakkali 2.0 on loop ,masakkali,other
the blurred man Sstepheniscowboy honesty all these dettol ads have put me firmly on the side of the 01% of bacteria it doesni't kil Mogan Townsend Smmtowne Nocoscoso there's another one WHYYYYYYYYYYYY the the eoda thee Det Seunch Gert t0:21 AM Sep 1 2n2e ,dettol,other
Alan Meaney Dlanveeney Home schooling Day 1: We're 11 mins in and all going well GF ,home schooling day,other
"When the teacher seats you one seat apart to stop you from talking MET BYB BYB @EvoNIK ""LOCKDOWN HAS AFFECTED EVERY ONE OF US.. - Jennifer Aniston - 09 リリ DEWILDERDUSS ",teacher,other
TRUMP WORE A MASK! ATH WE HATE MASKS NOW! imgflip.com ,masks,other
"In Home Alone 2, Trump tells Macaulay Culkin to get the fuck out of his hotel unless he can find himself an N95 mask and practice better social distancing. ",mask,other
"66% WONT CANCEL IN TIER ECITES. * India imarriages in April-Junel Hope to go ahead 45% To postpone or cancel *but trend varies in metro cittes 49% SIK Delhi-NCR Mumbat Bengaluru 38% 34% 62 72% 66% Tier 2 Oties Chennal Hyderabad *Lucknow, Indore Agra, Pune, Vizag, Ahmedabad. Vijaywada ",pune,other
Fun facts with Squidward! If you put corona virus backwards in google translate from Romanian to english you see this Rumanisch - Englisch a noroc suriv| good luck surviving weal t ,coronavirus,other
"O toothbrusharmy Follow Me laughing at coronavirus memes LAUGHENGI Me stil having to show up to work, actually concerned about coronavirus (CRYING ",work,other
I think lantaCurle is junt Modjis wwy of making people feel what he feels when he isni't abie to go abroad ,janata curfew,other
ANYTIME FITNESS nduly TURNS OUT THAT WAS A LIE ,anytime fitness,other
"LET ME BE CLEAR. I IGNED THE MEDICAL APPLIANCE TAX BILL THAT FORCED COMPANIES TO OUTSOURCE MANUFACTORING OF MASKS, GOWNS, GLOVES AND VENTILAORS TO CHINA, EUROPE AND RUSSIA TO AVOID THE TAX. ",europe,other
ICMR AIMS TO LAUNCH COVID-19 VACCINE BY AUGUST 15 AFTER COMPLITION OF CLINICAL TRIALS TELUGU FLEETS I'm waiting COVAXIN ,indian council of medical research (icmr),other
"Gitehing Queen OGrincher Add your best Coronavirus meme here if you got one NO, I SAID I HAVE A CASE OF CORONA YOU SAID YOU WERE SICK! Corona Eaira an8 AM Mar 2, 2020- Twitter Web Aoe 77 Retweets 850 Lives ",coronavirus meme,other
I think lantaCurle is junt Modjis wwy of making people feel what he feels when he isni't abie to go abroad ,janta curfew,other
"101-Year-Old Man Who Survived Spanish Flu and World War 2, Now Beats Coronavirus Too FinallyA worthy opponenti Our battle will be legendary! ",coronavirus,other
DONALD TRUMP CURRENT COVID-19 PANDEMIC TIGER KING PARDON ,pandemic,other
"meg slay, sec of antita Greameglay Trump's doctors prescribing hydroxychloroquine and disinfectant for Covid-19. HTrumpHasCovid helth 0G AM Oct 2, 2000 Teitter for Android ",disinfectant,other
Say no to Corona Virus torona Light TSINGTAO AERS ,coronavirus,other
Officials Just Confirmed China's Mystery Virus Spreads by Human to Human Transmission The guy Playing Plague Inc. on the Area 51 Computer ,area 51,other
China pneumonia outbreak: Mystery virus probed in Wuhan 8 hours ago Reddit DOES NOT SIMPLY PREDICT THE FUTURE We predict future ,reddit,other
There's been plauges in the 20's of different centuries There's a case of a virus in China The first death is reported in China from the virus The first case of the virus has been confirmed in the US ,plagues,other
"""In the year 2020 humanity was threatened with extinction. Panic spread across the planet like never before"" ""What were you doing grandpa?"" ""Just sending memes to friends and stuff"" ",memes,other
"WOR ""The pandemic represents a rare but narrow window ECONE of opportunity to reflect, reimagine, and reset our FORU world."" Klaus Schwab ",klaus schwab,other
Flexing in Flexing in March 2019 March 2020 ,flexing in 2019 vs 2020,other
malaikaaroraoflicial- fellow Airport fashion 2019 vs Airport fashion 2020 ,2019,other
Trump Finally Takes Off his Mask in Des Moines ,trump mask,other
"Chinese virologist Dr Li-Meng Yan 'Coronavirus created in a govt lab in Wuhan,' says whistleblower COMEDY AAAAND SHE'S GONE ",lei-meng yan,other
neone: HoW'S life going? How's life Мe: How bad a driver are you to hil a car in quarantine traffic? ,quarantine,other
"#meetingprofs when live events finally come back Oh my God! Okay, it's happening Everybody stay calm, everybody stay calm! Oecontectmeotings ",professors,other
"THE FRENCH DISEASE ENGLISH SWEATING SICKNESS THE SPANISH INFLUENZA AFRICAN SLEEPING SICKNESS WUHAN VIRUS Ekes com Call it Coronavirus, you round-eyed racists! imgflip.com ",english sweating sickness,other
Unfortuantely the tests came back positive for COVID-19. You have coronavirus. can't be correct I have over 40 cases of costoo water and 200 rolls of toiket paper. ,covid19,other
THERE IS A MUCH MORE SINISTER REASON WHY CHINA LET THE VIRUS GO AND WITHHELD INFORMATION. AS PELOSI SAID.CHINA PREFERS BIDEN TO WIN THE ELECTION. WHERE'S HUNTER? WILL HUNTER BE SUICIDED LIKE EPSTEIN? ndio.com ,hunter biden,villain
THE DAILY SHOW TRUMP'S CRINGEY CORONAVIRUS ADDRESS ,donald trump,villain
seniors facetiming in for virtual prom: Media: Coronavirus! Stock Market Crashing! Oil War in Saudi! ,virtual prom,other
"Chance a virus with a 99.97% recovery rate • FALSE Alter my DNA from an experimental vaccine, with NO liabilty, from a corrupt industry ",virus,other
The only mask Trump will wear ,donald trump,other
when you thought you caught the Corona Virus bút the doctor says it's just cancer ,cancer,other
"PARENTSAFTER CORONA VIRUS FORCES THEM TO TEACH AT HOME O knew exactly what to do, But in a much more real sense, I had no idea what to do. ",parents,victim
"Me trying to work from home, watch my kids, stay hydrated, not be broke, stay quarantined, find toilet paper, wash my hands and stop touching my Dang face. ",kids,other
Asians The entire fuckin pkanat ,planet,victim
Spent a week without leaving India. ,narendra modi,other
WHY SHOULD WE LISTEN TO DOCTORS &SCIENTISTS WHEN THEY ARE THE ONES BRE WHO STARTED THIS VIRUS? ,scientists,villain
"This Tinder profile Coronavirus 18 omete y Newin town, looking for fun Just got out of China, Develing the world wondetust lon Love being outdoors, enpecielv in crowded places Mask and gogglen are a huge tam of Spe left if you're a doctor Give me a chence, ke your breet wey and ieeve you in bed for deys ",tinder,other
Government: please work from home EA employees: boredpanta.com ,work from home,other
Me in Quarantine BEFORE AFTER ,quarantine,other
Experts Say Deadly Wuhan Virus Can Be Killed By Alcohol & High Temperatures! KILLED BY ALCOHOL& TEMPERATURES ABOVE 57 DEGREES! Corona Extra Coronavirus DUOTU Experts Say Deadly Wuhan Virus Can Be Killed By Alcohol &amp; High Temperatures! ,china,other
"DONT WORRY, AMERave to stay in youe hosett ME: Fuck you Ineed some dic Covid 19 Memes CORONAVIRUS IS NOTHING COMPARED TO WINDMILL CANCER! Quates Hus ",covid19 memes,other
*Corona Virus spreads throughout world Area 51 worker playing Plague Inc on the wrong computer: ,coronavirus,other
IEME INSURGENT Mother Deadly Nature Wuhan Virus Humanity ,nature,other
Otark.sinatra 2nd wave of coronavirus States reopening too soon ,states opening too soon,victim
"Barry Petchesky @barry - Nov 9 Me and the bros 20 minutes after getting the COVID vaccine, even as the pharmacist chases after me yelling that you need a second dose for it to be Vaccine with 90% effective effectiveness Mink outbreak of mutated coronavirus ",coronavirus,other
How Texpected my apocalypse outfit to look How lactually look ,apocalypse,other
When you are laughing at all the corona memes but the laughing suddenly turns into coughing ,coronavirus memes,other
CHINA IS WHERE THE VIRUS ORIGINATED CHINA SILENCED WHISTLEBLOWERS AND COVERED IT UP CHINA LIED TO THE WORLD ABOUT THE EXTENT OF THE OUTBREAK CHINA REFUSED OFFERS OF HELP IN CONTAINING THE VIRUS CHINA INFECTED THE WORLD ,china,villain
"AND JUST LIKE THAT IT TURNS OUT WE ""COULD WORK FROM HOME ",work from home,other
WHAT DONALD TRUMP LOOKS LIKE UNDER HIS MASK ,donald trump,other
JUST TO BE CLEAR NONE OF THIS MATTERS IF THERE IS A VIRUS ,virus,other
The. Guardian Eminem criticises non-mask wearers on new rap track 1 day ago AP Associated Press Trump wears mask in public for first time during pandemic 4 hours ago Coincidence I THINK NOT ,greta thunberg,other
"FUNNY CORONAVIRUS HUMOR DAILY DOG COVID-19 MEMES, GIFS, VIDEOS AND MORE! ",coronavirus,other
UFC was here Khabib vs. Tony COVID-19 ,covid19,other
DALYMAL CO UK Chinese woman scares away rapiet by pretending to cough and telling him she la from Wuhan Modern problems require modern solutions ,chinese woman,other
People with the flu: stay home sick all day People with coronavirus: / travel the world and the Seven SeasN ,flu infected people,other
In casee mnks e otola Corona ,corona,other
Goment: Work ton hame Government Work from home Pets Zoologists ,painters,other
"O Nicole o eaurencolee Getting on Twitter to see that Trump AND Melania caught COID 12:00 PM Cet 2, 2020 O1 $ See the latest COVID-19 information on Twitter ",covid19,other
PROTESTING A LOCKDOWN IN VANCOUVER? LIKE WHERE MANY BUSINESSES VOLUNTARILY CLOSED? WHERE PEOPLE DONT NEED GOVERNMENT FORMS TO LEAVE THEIR HOUSE FOR GROCERIES OR WORK? WHERE PEOPLE ARE ASKED TO GO OUTSIDEP glo.com ,vancouver,other
And the Darwin Award (Honorable Mention) goes to: This Joker No Morals No Mask ingfio.com ,donald trump,villain
"BUSINESS INSIDER China confirmed that the deadly Wuhan virus sweeping the country can spread from human to human, increasing the risk of an epidemic ME PLAYING PLAGUE INC. REALIZING IT'S BECOMING REAL ",china,other
DoVoubonald.com COoyoudonaldc Can't die of COVID if you kill yourself! #Trump #Memes Is this a vaccine? ,covid,other
"I BET IF YOU TELL TRUMP THAT IF HIS SUPPORTERS DONT WEAR MASKS THEY WILL BE TOO SICK OR DEAD AND UNABLE TO VOTE FOR HIM, HE WOULD PASS A MASK LAW ",masks,other
"When you spend 236 days in lockdown, and on the day you get out, the govt imposes 21-day national lockdown: ",lockdown,other
"Corona virus Legolas, 18 already! Mass shootings in the US in 2020 I'm on 24 ",usa,victim
"LET ME GET THIS STRAIGHT, YOU THINK THE PRESIDENT GETTING COVID IS FUNNY? I DO. AND I'M TIRED OF PRETENDING IT'S NOT. ",president,other
WHEN YOU TURN AROUND AND A STUDENT IS GIN AWAY FROM YOU INSTEAD OF GFT ,social distancing,other
PEOPLE STILL TRAVELING RN TRYING NOT TO GET COVID-19 ,covid19,other
DR Bonnie Henry after 1mo. lockdown ME after 1 mo. lockdown ,dr. bonnie henry,other
Don't let the government fool you with this quarantine they only want you to stay home so they can change the batteries in the birds ,batteries,other
"IndieWire @indiewire Indeie Pattinson's 'Batman' Will Be 'So Raw' and 'Not Sanitized, Says Cast Member Peter Sarsgaard IMPAIGN Robby Slowik e @RobbySlowik The last thing the world wants right now is raw, unsanitized bat. ",peter sarsgaard,other
Family devastated when pet chews up life savings ,family,other
"Everyone: *cannot find any toilet paper or food in shops anymore, because it's all sold out"" The dude in math problems: Theywere laughing at me back then butnowllam the one laughing ",toilet paper,other
YOU CAN'T GET CORONAVIRUS IF YOU DON'T LEAVE THE HOUSE ,coronavirus,other
"TRUMP DOESN'T WANT TO WEAR A MASK BECAUSE HE THINKS HE'LL LOOK FOOLISH IT'S WAY TOO LATE, DIPSH'T ",donald trump,villain
If you need 144 rolls of toilet paper for a 14 day quarantine you probably should've been seeing a Doctor long before COVID-19 ,quarantine,other
NOW WHAT? Congratulations You've completed NETFLIX ,netflix,other
MY HANDS МЕ ,hands,other
How Texpected my apocalypse outfit to look How lactually look ,apocalypse outfit,other
"GAME OF THRONES CORONAVIRUS EDITION WASH YOUR HANDS, WHAS YU HAN, WASHU HAN, WASHUAN, WUHAN, WUHAN, WUHAN! ",coronavirus,other
When you find out your cousin is an asian: At least corona virus won't last long because it was made in china. ,china,other
"Why get the China Virus when you could get a case of Corona? NO, I SAID I HAVE A CASE OF CORONA 12 YOU SAID YOU WERE SICK! Corona Extra Corom Ea Cut Paste SPhotos alip.com 6:52 AM · 3/10/20 · Twitter for iPhone ",coronavirus,other
rajaravivarmamemes What's happening here? Umm. I think there IS such a thing as Zoom-Call-Exhaustion ,zoom call,victim
Korea is the 3rd biggest hit country from COVID-19 and we still have toilet paper. The moral of the story is people are idiots STRONG STRONG ,south korea,other
